Serial No,movie_id,movie_name,year,genre,overview,director,cast,poster_url,rating,votes
506,tt9098938,Sharmaji Namkeen,2022,"Comedy, Drama, Family",A light-hearted coming-of-age story of a lovable 60-year-old-man.,Hitesh Bhatia,"Rishi Kapoor, Paresh Rawal, Juhi Chawla, Isha Talwar",https://m.media-amazon.com/images/M/MV5BY2MxNjVlNjMtOGExMi00NWRjLThhYzQtNDY4OWZkMzcwNjhiXkEyXkFqcGdeQXVyMTI1NDEyNTM5._V1_.jpg,7.5,11241
507,tt11680920,Music School,2023,"Drama, Musical","This heart-warming 11-song musical is about how the prevailing Indian education system and parents put pressure on children to be competitive in their ""studies, thereby leaving no time for ...                See full summary »",Paparao Biyyala,"Shriya Saran, Sharman Joshi, Prakash Raj, Mona Ambegaonkar",https://m.media-amazon.com/images/M/MV5BMGEwOWZmMTAtNzU3Mi00NjE5LTlkMTUtOWI0NWIwODc5MzlhXkEyXkFqcGc@._V1_.jpg,6.2,711
508,tt10739666,Satyameva Jayate 2,2021,"Action, Crime, Drama","Satyameva Jayate 2 revolves around the fight against injustice and misuse of power. From police and politicians to industrialists and a common man, the film will explore corruption in all spheres.",Milap Zaveri,"John Abraham, Divya Khosla Kumar, Harsh Chhaya, Gautami Kapoor",https://m.media-amazon.com/images/M/MV5BNWE0OTE0ODUtY2Q0ZS00NDQxLTlhMmItYjM1MmI3MDVkMjNhXkEyXkFqcGc@._V1_.jpg,3.4,16223
509,tt9052960,Laal Kaptaan,2019,"Action, Adventure, Drama","In an 18th century setting, a Naga sadhu in India sets out on a journey across Bundelkhand to seek revenge for an injustice committed in the past.",Navdeep Singh,"Saif Ali Khan, Zoya Hussain, Manav Vij, Deepak Dobriyal",https://m.media-amazon.com/images/M/MV5BNzcwZGQ1OWQtOWQxNC00YmM0LWIyMmYtMTM5MmQ5ODYyMjJhXkEyXkFqcGc@._V1_.jpg,7.2,5499
510,tt6923462,Manto,2018,"Biography, Drama",The film is a biographical account of writer Saadat Hasan Manto's life and is set in 1940s India.,Nandita Das,"Nawazuddin Siddiqui, Rasika Dugal, Tahir Raj Bhasin, Nazma Ali Shaikh",https://m.media-amazon.com/images/M/MV5BZjZmMmQxOTMtNjdhZS00MjAxLWEwNTQtNTQzM2Y0NTYzY2YzXkEyXkFqcGc@._V1_.jpg,7.3,4766
511,tt0347332,Khakee,2004,"Action, Crime, Drama",A team of police force escorts an alleged terrorist from Chandangarh to Mumbai. However their trip turns into a deadly survival when an ex-cop tries to stop them to reach Mumbai.,Rajkumar Santoshi,"Amitabh Bachchan, Akshay Kumar, Ajay Devgn, Aishwarya Rai Bachchan",https://m.media-amazon.com/images/M/MV5BN2VmYzgwOTgtNDlmZC00ZjhjLWI3MGYtMWJiOGQwZjg0MjczXkEyXkFqcGc@._V1_.jpg,7.4,16620
512,tt10443846,Yeh Saali Aashiqui,2019,"Drama, Romance, Thriller","While in college, Sahil and Mittee fall in love, but an unfortunate incident turns their dreamy romance into a nightmare.",Cherag Ruparel,"Vardhan Puri, Shivaleeka Oberoi, Ruslaan Mumtaz, Satish Kaushik",https://m.media-amazon.com/images/M/MV5BNmVkMTAzMzctOWQ0OS00OTFkLTljN2YtZjQ2ODA1ZGVhZTkyXkEyXkFqcGc@._V1_.jpg,7.8,4788
513,tt0323013,Lakshya,2004,"Action, Drama, Romance","An aimless, jobless, irresponsible grown man joins the army and matures into a battlefield hero.",Farhan Akhtar,"Hrithik Roshan, Preity G Zinta, Amitabh Bachchan, Om Puri",https://m.media-amazon.com/images/M/MV5BNzJhOWIzZjUtYzhhOS00MjcwLTkxOGQtYTgwMWU0MzA3NDQ0XkEyXkFqcGc@._V1_.jpg,7.8,25857
514,tt7725596,Badhaai ho,2018,"Comedy, Drama",A man is embarrassed when he finds out his mother is pregnant.,Amit Ravindernath Sharma,"Ayushmann Khurrana, Neena Gupta, Gajraj Rao, Sanya Malhotra",https://m.media-amazon.com/images/M/MV5BNjk5NjcyZTItMzE4OC00OWY5LWJmMTUtNzZjNmMwODFkNjkxXkEyXkFqcGc@._V1_.jpg,7.9,38322
515,tt1836987,Trishna,2011,Drama,The story of the tragic relationship between the son of a property developer and the daughter of an auto rickshaw owner.,Michael Winterbottom,"Freida Pinto, Riz Ahmed, Mita Vashisht, Harish Khanna",https://m.media-amazon.com/images/M/MV5BMTkxMTU0MTY1M15BMl5BanBnXkFtZTcwMTExMjc3Nw@@._V1_.jpg,6,3351
516,tt10062614,Guilty,2020,"Drama, Thriller","When a college heartthrob is accused of rape by a less popular student, his girlfriend navigates various versions of the story in search of the truth.",Ruchi Narain,"Kiara Advani, Taher Shabbir, Akansha Ranjan Kapoor, Gurfateh Pirzada",https://m.media-amazon.com/images/M/MV5BYWYxMjBlZjEtY2ZkYS00OWE1LWEzNTAtNDlkZWE5NzI1NDE1XkEyXkFqcGdeQXVyMTA5NzIyMDY5._V1_.jpg,5.4,4801
517,tt13795296,Thank God,2022,"Comedy, Fantasy","An egoistic real estate broker in huge debts, meets with an accident.God appears in front of him and informs him that he will have to play a ""GAME OF LIFE"". If he win, he will be sent back to earth and if not, he will be sent to hell.",Indra Kumar,"Sidharth Malhotra, Ajay Devgn, Rakul Preet Singh, Mahesh Balraj",https://m.media-amazon.com/images/M/MV5BYTBmNTgxMTEtZWY1Ny00MTJmLTlhYmQtOGRhZGZhN2QzYzliXkEyXkFqcGc@._V1_.jpg,5.6,12660
518,tt0099652,Ghayal,1990,"Action, Crime, Drama","Ajay Mehra, an amateur boxer, takes revenge against Balwant Rai, a crooked businessman, after his elder brother is killed.",Rajkumar Santoshi,"Sunny Deol, Amrish Puri, Meenakshi Sheshadri, Moushumi Chatterjee",https://m.media-amazon.com/images/M/MV5BNDJiN2M4M2ItYjE4ZS00MGMzLTk3NjQtNzI1NzhmMTllYjY1XkEyXkFqcGc@._V1_.jpg,7.7,5248
519,tt4864932,Baaghi,2016,"Action, Romance, Thriller",A martial arts student seeks revenge after the murder of his master.,Sabir Khan,"Tiger Shroff, Shraddha Kapoor, Sudheer Babu Posani, Shifuji Shaurya Bharadwaj",https://m.media-amazon.com/images/M/MV5BMzczODY2ZmMtYjU4MS00MzFjLTk2YTAtYTMyMmFlNTk3OTIyXkEyXkFqcGc@._V1_.jpg,5.3,10070
520,tt2979920,Bombay Velvet,2015,"Action, Crime, Drama",An ordinary man goes against all odds and forges his destiny to become a 'Big Shot'.,Anurag Kashyap,"Ranbir Kapoor, Anushka Sharma, Karan Johar, Satyadeep Misra",https://m.media-amazon.com/images/M/MV5BMTg5OTA2NDk4OF5BMl5BanBnXkFtZTgwNjExMzQ5NDE@._V1_.jpg,5.5,6437
521,tt1891884,Once Upon a Time in Mumbai Dobaara!,2013,"Action, Crime, Drama","After killing his mentor, a gangster comes into power to rule over Mumbai. In the process he falls for an aspiring actress, nevertheless he finds that his protege has fallen for her too which leads to enmity between them.",Milan Luthria,"Akshay Kumar, Imran Khan, Sonakshi Sinha, Sonali Bendre",https://m.media-amazon.com/images/M/MV5BNGEzNGIxMTctYzhmNC00YTM2LTllZmQtNDhiN2JmMTkxYzI2XkEyXkFqcGc@._V1_.jpg,4.4,7737
522,tt7469726,Shaadi Mein Zaroor Aana,2017,"Drama, Romance","Satyendra Mishra ""Rajkumar Rao"" and Aarti Shukla ""Kriti Kharbanda"" agree to get married arranged by their parents, after Satyendra Mishra get government job. Aarti Shukla, run away from their marriage. What life waits for them ahead?",Ratnaa Sinha,"Rajkummar Rao, Kriti Kharbanda, K.K. Raina, Alka Amin",https://m.media-amazon.com/images/M/MV5BOTY3NmM1MGYtOWFjNy00YjY3LThhODMtZGEyZDNhMTUxM2U2XkEyXkFqcGc@._V1_.jpg,7.5,18391
523,tt0456144,Lage Raho Munna Bhai,2006,"Comedy, Drama, Romance",Munna Bhai embarks on a journey with Mahatma Gandhi in order to fight against a corrupt property dealer.,Rajkumar Hirani,"Sanjay Dutt, Arshad Warsi, Vidya Balan, Boman Irani",https://m.media-amazon.com/images/M/MV5BN2ZmMDMwODgtMzA5MS00MGU0LWEyYTgtYzQ5MmQzMzU2NTVkXkEyXkFqcGdeQXVyODE5NzE3OTE@._V1_.jpg,8,50019
524,tt8908002,Luka Chuppi,2019,"Comedy, Romance","Pretending to be married in order to cohabitate, a small-town couple lands in endless awkward situations to hide the truth from their orthodox families.",Laxman Utekar,"Kartik Aaryan, Kriti Sanon, Aparshakti Khurana, Pankaj Tripathi",https://m.media-amazon.com/images/M/MV5BYWEyY2NkYmMtMGQ4Ni00ZTgzLThhNDMtNmI3ZTI5MDJiY2EyXkEyXkFqcGc@._V1_.jpg,6.4,14019
525,tt1916728,Shor in the City,2010,"Crime, Drama",Various residents and career-criminals face challenges in crime-laden Mumbai.,"Krishna D.K., Raj Nidimoru","Tusshar Kapoor, Sendhil Ramamurthy, Nikhil Dwivedi, Preeti Desai",https://m.media-amazon.com/images/M/MV5BNmVjM2U3NzYtNGQxMy00YjMxLWEyZDAtZjNjOTk0MDA0YTUyXkEyXkFqcGc@._V1_.jpg,7.2,4214
526,tt8108274,Tanhaji: The Unsung Warrior,2020,"Action, Biography, Drama","Tanhaji Malusare, a military chieftain in the army of the Maratha king Shivaji, leads the charge to capture the strategically important Kondhana fort guarded by the army of the fierce Rajput chieftain Udaybhan Rathod.",Om Raut,"Ajay Devgn, Saif Ali Khan, Sharad Kelkar, Kajol",https://m.media-amazon.com/images/M/MV5BNTRlMjdjYmEtZmY3MC00MzdhLWFiZmMtNGViZDRmYTJkNmY5XkEyXkFqcGc@._V1_.jpg,7.5,36869
527,tt18250130,Neymar,2023,"Comedy, Family",Kunjava and his friend Sinto bring a new furry friend named Neymar into their lives. Little did they know that their lives were about to be turned upside down.,Sudhi Maddison,"Naslen, Mathew Thomas, Thushara Pillai, Vijayaraghavan",https://m.media-amazon.com/images/M/MV5BNjM3MjU0NGQtNTljYS00MDJlLTk2MTctN2U1YjgzYzhmOTQ0XkEyXkFqcGc@._V1_.jpg,6.5,1176
528,tt11651796,AK vs AK,2020,"Action, Comedy, Crime","A filmmaker kidnaps the daughter of a movie star, and while the star searches for his daughter the director films the desperate search in real time for his next blockbuster movie.",Vikramaditya Motwane,"Anil Kapoor, Anurag Kashyap, Sonam Kapoor, Harshvardhan Kapoor",https://m.media-amazon.com/images/M/MV5BNDJkOTVkYTMtMTk2OC00YTkyLThjMGYtMTdiYWRjYTQ1YTYzXkEyXkFqcGdeQXVyODE5NzE3OTE@._V1_.jpg,6.9,15285
529,tt5120640,Sarbjit,2016,"Biography, Drama","Biopic of Sarabjit Singh, a farmer residing at Bhikiwind, Punjab, near the Indo-Pak border, crossed the border after having a couple of drinks. However, he was mistaken to be an Indian spy and was sentenced with capital punishment.",Omung Kumar,"Randeep Hooda, Aishwarya Rai Bachchan, Richa Chadha, Darshan Kumaar",https://m.media-amazon.com/images/M/MV5BMGVlNGVmYzgtMDlmZi00NTZiLWJmM2QtNjk4MzNhM2Q3YjFiXkEyXkFqcGc@._V1_.jpg,7.3,5505
530,tt16139054,Connect,2022,Thriller,"In a country where the government imposed a national curfew and a single mother, Nayanthara, notices eerie changes in her daughter's behaviour. On getting virtual help from a pastor played by Anupam Kher who proposes an online exorcism.",Ashwin Saravanan,"Nayanthara, Sathyaraj, Anupam Kher, Vinay Rai",https://m.media-amazon.com/images/M/MV5BNjg0M2RiZDMtZDgwNy00ZjU1LTgwNmUtZjQ2ODMzYWVlOTQ0XkEyXkFqcGc@._V1_.jpg,5.2,948
531,tt13381376,Welcome Home,V2020,"Crime, Drama, Horror","A census report leads two female government teachers to an isolated house, in which resides a family with twisted secrets they never imagined to recover.",Pushkar Mahabal,"Kashmira Irani, Swarda Thigale, Shashi Bhushan, Boloram Das",https://m.media-amazon.com/images/M/MV5BZTQ5YmM3ZWUtNTkxMS00M2U5LWIwN2ItNDM0OTIwNmRlN2FhXkEyXkFqcGc@._V1_.jpg,7.4,5003
532,tt7218518,Padman,2018,"Comedy, Drama","Upon realizing the extent to which women are affected by their menses, a man sets out to create a sanitary pad machine and to provide inexpensive sanitary pads to the women of rural India.",R. Balki,"Akshay Kumar, Radhika Apte, Sonam Kapoor, Jyoti Subhash",https://m.media-amazon.com/images/M/MV5BOGE4MTIwODQtMWQzNC00NGU4LTgwMjUtNGZjZDgxZGFlMDU3XkEyXkFqcGc@._V1_.jpg,7.9,29066
533,tt15341044,Laththi,2022,"Action, Crime, Drama","A police constable, who gets trapped in a building with his 10-year-old kid, and how they escape from the building surrounded by a group of the enemy.",A. Vinoth Kumar,"Vishal, Sunaina, Prabhu, Thalaivasal Vijay",https://m.media-amazon.com/images/M/MV5BYWZiYzIzMDUtYzZkZS00MjRlLWE4ZjctNjZhMjhmNjE3N2I3XkEyXkFqcGc@._V1_.jpg,6.5,3010
534,tt5662932,Raman Raghav 2.0,2016,"Crime, Drama, Thriller","Ramanna, a maniac murderer, finds a soulmate in Raghavan, a policeman, who inspects his murder cases. He tries to make Raghavan realize how they both are similar.",Anurag Kashyap,"Nawazuddin Siddiqui, Vicky Kaushal, Sobhita Dhulipala, Mukesh Chhabra",https://m.media-amazon.com/images/M/MV5BYWIyZWIzODUtMzRlZC00ZTgyLThkZjQtN2Y5NTJkNmEwOWJmXkEyXkFqcGc@._V1_.jpg,7.3,15955
535,tt1433810,Dhobi Ghat,2010,Drama,"The lives of four people intersect in Mumbai: a washer-man who wants to become an actor, a banker-turned-photographer, a painter looking for inspiration, and a newly-married immigrant who journals her experiences on home video.",Kiran Rao,"Prateik Patil Babbar, Monica Dogra, Kriti Malhotra, Aamir Khan",https://m.media-amazon.com/images/M/MV5BMTQ0NDIzMzE3OF5BMl5BanBnXkFtZTcwMDUxNzAzNA@@._V1_.jpg,7,13777
536,tt0085178,Ardh Satya,1983,"Crime, Drama","A newly appointed police rookie deals with corruption, romance, and brutality.",Govind Nihalani,"Om Puri, Smita Patil, Amrish Puri, Shafi Inamdar",https://m.media-amazon.com/images/M/MV5BMDFiNGE4ODQtMTE4Ny00NDRhLThhODYtMmE5MmY4NGFjMzRiXkEyXkFqcGc@._V1_.jpg,8.1,2180
537,tt8948790,Jersey,2019,"Drama, Sport",A failed cricketer decides to revive his cricketing career in his late 30's despite everyone being skeptical of his ability to do so.,Gowtam Tinnanuri,"Nani, Shraddha Srinath, Sathyaraj, Ronit Kamra",https://m.media-amazon.com/images/M/MV5BYjc0MWFiYTMtNmYyOS00ODczLWEyMzItNzI4YjY0YjJjZGVjXkEyXkFqcGdeQXVyNzEwNjg3MjE@._V1_.jpg,8.5,22380
538,tt9420648,Bala,2019,Comedy,It tells the story of a man who is balding prematurely and how he copes up with the situation.,Amar Kaushik,"Ayushmann Khurrana, Bhumi Pednekar, Yami Gautam, Saurabh Shukla",https://m.media-amazon.com/images/M/MV5BM2FlODNjNDgtMDg3OS00ZDM3LTk1ODMtOTUxNDliZjBiMzdhXkEyXkFqcGc@._V1_.jpg,7.3,16612
539,tt0499375,Guru,2007,Drama,"A villager, Gurukant Desai, arrives in Bombay 1958, and rises from its streets to become the GURU, the biggest tycoon in Indian history.",Mani Ratnam,"Mithun Chakraborty, Abhishek Bachchan, Aishwarya Rai Bachchan, Madhavan",https://m.media-amazon.com/images/M/MV5BNDgzMjliNDAtMGJkNy00ZTUzLWIyMTAtNWZkNmY2MDNiZjE3XkEyXkFqcGc@._V1_.jpg,7.7,25336
540,tt28494851,Stolen,2023,"Drama, Thriller","A five month old baby of an impoverished tribal woman Jhumpa Mahato is stolen.Two brothers ,Gautam and Raman, witness the kidnapping ,try to help her when they become embroiled in the complexities of the investigation.",Karan Tejpal,"Abhishek Banerjee, Harish Khanna, Mia Maelzer, Sahidur Rahaman",https://m.media-amazon.com/images/M/MV5BMTZmMzYwMDAtNzQ4Mi00NTEyLTlmZjEtYzg5MjEyNWEyNDM4XkEyXkFqcGc@._V1_.jpg,7.2,143
541,tt0444781,Deewane Huye Paagal,2005,"Action, Comedy, Drama","A man embarks on journey to find his love in Dubai, only to learn she has different suitors and admirers.",Vikram Bhatt,"Shahid Kapoor, Akshay Kumar, Suniel Shetty, Rimi Sen",https://m.media-amazon.com/images/M/MV5BY2EyNzcwNWMtYmNjNy00Yzk5LWFhYjUtNTM1ODQ0YTJiNDMxXkEyXkFqcGc@._V1_.jpg,5.6,6120
542,tt13143988,Nail Polish,2021,Drama,"Nail Polish, written and directed by Bugs Bhargava Krishna, stars Arjun Rampal, Manav Kaul, Anand Tiwari and Rajit Kapur. It's a legal thriller that explores the uncertainty of the human mind.",Bugs Bhargava Krishna,"Arjun Rampal, Manav Kaul, Anand Tiwari, Rajit Kapoor",https://m.media-amazon.com/images/M/MV5BY2IzNjcxMjQtNDIzMi00ZTY0LWIyMWMtODE0NjY4YTk3ZGU1XkEyXkFqcGc@._V1_.jpg,7.2,5804
543,tt13793230,Jaadugar,2022,"Comedy, Drama, Fantasy","Magic Meenu, a small-time magician in Neemuch, M.P., has to win a local football tournament in order to marry the girl he loves.",Sameer Saxena,"Jitendra Kumar, Arushi Sharma, Jaaved Jaaferi, Raksha Panwar",https://m.media-amazon.com/images/M/MV5BYzY0MGMyMjYtODA2Ny00MDEwLTlkZTEtY2VmYzcwNDRiNzczXkEyXkFqcGdeQXVyODE5NzE3OTE@._V1_.jpg,6.8,11538
544,tt2226666,Jism 2,2012,"Drama, Romance, Thriller","Izna, a porn star, is tasked by an Indian Intelligence Agency to seduce her ex-boyfriend Kabir, a dreaded assassin, in order to steal vital information relating to his sleeper cell contacts.",Pooja Bhatt,"Randeep Hooda, Arunoday Singh, Arif Zakaria, Sunny Leone",https://m.media-amazon.com/images/M/MV5BNDdmNTdiOWQtOTBjMy00Y2Q4LThlOTgtYmU4NjBjMGM0YTZlXkEyXkFqcGc@._V1_.jpg,3.1,3715
545,tt23804378,Three of Us,2022, ,"A delicate thread of emotions about love, loss, healing, awareness and liberation.",Avinash Arun,"Shefali Shah, Jaideep Ahlawat, Swanand Kirkire, Kadambari Kadam",https://m.media-amazon.com/images/M/MV5BZWMzNWJlOGQtMzQwOC00YWRmLThhOTctOTZmNjgxZGFlNGUwXkEyXkFqcGdeQXVyODE5NzE3OTE@._V1_.jpg,7.5,4154
546,tt0991346,Bhootnath,2008,"Comedy, Drama, Family","Moving into a new house, a family witnesses an unfriendly ghost who wants to drive them away from the house. However, he befriends a little boy who changes his outlook forever.",Vivek Sharma,"Amitabh Bachchan, Juhi Chawla, Satish Shah, Rajpal Naurang Yadav",https://m.media-amazon.com/images/M/MV5BOTQ4NmM4YzEtZGUxNy00MmQ5LTg5NzUtMDJjMGQ3ZWRlYjJiXkEyXkFqcGc@._V1_.jpg,6.4,11316
547,tt6531196,Ascharyachakit!,2018,"Drama, Romance","Desire and greed intertwines the lives of a Bollywood star, his chauffeur, a prostitute and her pimp in an unlikely love story.",Samit Kakkad,"Priyanka Bose, Vaibhav Raj Gupta, Ankit Raj, Anangsha Biswas",https://m.media-amazon.com/images/M/MV5BYzM3NTVmYmYtYzU2ZS00MTczLWI0NWEtNmUwYjg2NGZlMTIwXkEyXkFqcGc@._V1_.jpg,5,1047
548,tt1841542,Chillar Party,2011,"Comedy, Drama, Family",A gang of innocent but feisty kids who lead carefree lives in Chandan Nagar colony takes on the big bad world of politics when one of their friend's life is endangered.,"Vikas Bahl, Nitesh Tiwari","Irfan Khan, Abhinay Raj Singh, Sanath Menon, Rohan Grover",https://m.media-amazon.com/images/M/MV5BOGUxMGUyODEtYjcyNi00YjBiLTk1ZDgtMDEyYTUyNzA1OTQ4XkEyXkFqcGc@._V1_.jpg,7.5,8962
549,tt16915334,Chakda Xpress,2023,"Biography, Drama, Sport",It is inspired by the journey of Jhulan Goswami as she moves up the ladder despite the problems created by misogynistic politics to fulfill her dream of playing cricket for India,Prosit Roy,"Anushka Sharma, Anshul Chauhan, Dibyendu Bhattacharya, Nishu Dikshit",https://m.media-amazon.com/images/M/MV5BNjNlZWNiMTYtMmMxMy00M2I1LTk5MjMtZGQwYTcyNDRhOTEyXkEyXkFqcGc@._V1_.jpg,,
550,tt1667838,I Hate Luv Storys,2010,"Comedy, Drama, Romance","Jay doesn't believe in love Stories, and Simran, is a girl who's in love with the idea of Love itself.",Punit Malhotra,"Imran Khan, Sonam Kapoor, Sammir Dattani, Samir Soni",https://m.media-amazon.com/images/M/MV5BYTA5ZmQwZDEtZTczZC00ZDQ2LTg5ZTgtOGE2ZWVkZTA2N2Y4XkEyXkFqcGc@._V1_.jpg,5.7,8814
551,tt0315642,Wazir,2016,"Action, Crime, Drama",A grief-stricken cop and an amputee grandmaster are brought together by a peculiar twist of fate as part of a wider conspiracy that has darkened their lives.,Bejoy Nambiar,"Amitabh Bachchan, Farhan Akhtar, Aditi Rao Hydari, John Abraham",https://m.media-amazon.com/images/M/MV5BMTUzNDU4NDMyOV5BMl5BanBnXkFtZTgwNjcyNzU0NzE@._V1_.jpg,7.1,19949
552,tt1146325,Singh Is Kinng,2008,"Action, Comedy, Crime","A comic caper about Happy Singh, a Punjabi villager who goes through a series of misadventures and eventually becomes the King of the Australian underworld.",Anees Bazmee,"Akshay Kumar, Katrina Kaif, Om Puri, Kirron Kher",https://m.media-amazon.com/images/M/MV5BZDZlMGYxYTktZTRkYS00YTZlLThlYzYtODEzODIwZTE3NWNiXkEyXkFqcGc@._V1_.jpg,5.8,16830
553,tt2556308,Holiday,2014,"Action, Crime, Thriller","A military officer attempts to hunt down a terrorist, destroy a terrorist gang and deactivate the sleeper cells under its command.",A.R. Murugadoss,"Akshay Kumar, Sonakshi Sinha, Freddy Daruwala, Sumeet Raghavan",https://m.media-amazon.com/images/M/MV5BNTUzZDBiOWEtMGM3MC00OWFiLWFiNDgtYjIxYWZjZWQ0Mjg5XkEyXkFqcGc@._V1_.jpg,7.2,30276
554,tt10534500,#Home,2021,Drama,"Oliver Twist (Indrans) wants to be tech-savvy and become a better companion to his two sons, who spend more time on their phones than with their loved ones.",Rojin Thomas,"Indrans, Sreenath Bhasi, Manju Pillai, Naslen",https://m.media-amazon.com/images/M/MV5BNWU1ZmNlYTctYmY1My00ZDlmLTk3M2EtZDcxY2E1ZGU0N2YzXkEyXkFqcGdeQXVyMTI1NDAzMzM0._V1_.jpg,8.8,15706
555,tt7529298,Attack,2022,"Action, Sci-Fi, Thriller",Witness the rise of an army soldier as he realizes his destiny and comes to terms to becoming India's first super soldier created to combat terrorists as he fights his inner demons and outer enemies.With lots of action,Lakshya Raj Anand,"John Abraham, Jacqueline Fernandez, Rakul Preet Singh, Prakash Raj",https://m.media-amazon.com/images/M/MV5BZWYzNDcxNjQtNDZjNS00M2U3LTlkOTItNDc4NzhkMjYxNzFkXkEyXkFqcGc@._V1_.jpg,6.8,16718
556,tt13534808,Janhit Mein Jaari,2022,"Comedy, Drama, Romance","The story of a young girl, a crusader who takes up a challenging job selling condoms in a small town in MP, India.",Jai Basantu Singh,"Nushrratt Bharuccha, Vijay Raaz, Alok Nath Pathak, Tinnu Anand",https://m.media-amazon.com/images/M/MV5BNGU2ZTEyNjEtMGRjMS00YzE3LWFmOWMtMzM2NDZlMjQwY2EyXkEyXkFqcGc@._V1_.jpg,6.8,7980
557,tt0246729,Khiladiyon Ka Khiladi,1996,"Action, Crime, Drama",A man (Akshay Kumar) searches for his missing brother (Inder Kumar) who is also wanted by the police.,Umesh Mehra,"Akshay Kumar, Rekha, Raveena Tandon, Deven Verma",https://m.media-amazon.com/images/M/MV5BYTFlZWE2MWYtMzFmZC00MjYxLWIyMTEtMjVhMmU4NTM2MmNjXkEyXkFqcGc@._V1_.jpg,6,6439
558,tt8361196,Vinaya Vidheya Rama,2019,"Action, Drama","When the happiness of his family is held to ransom by a violent crime lord, Ram sets out on a quest to destroy his nemesis and his criminal empire.",Boyapati Srinu,"Ram Charan, Vivek Oberoi, Kiara Advani, Mahesh Manjrekar",https://m.media-amazon.com/images/M/MV5BZmM0NGVjOTctNDhlOC00ZTU1LWE1OTItYjcyYWIwYzUzNDJhXkEyXkFqcGc@._V1_.jpg,3.3,4050
559,tt5325684,Hate Story IV,2018,"Crime, Drama, Thriller","Aryan and Rajveer, sons of a wealthy businessman, Vikram Khurana, fall in love with the same woman, Tasha. Not only do they commit a deed they cannot undo but also end up as targets in a revenge plan.",Vishal Pandya,"Urvashi Rautela, Gulshan Grover, Lee Byford, Komal Chhabria",https://m.media-amazon.com/images/M/MV5BMTRkODNjNjgtMzdiZS00YWQxLTg1MzMtYTc1ZTYxZGMyNjhlXkEyXkFqcGc@._V1_.jpg,3.4,1890
560,tt3410408,Rocky Handsome,2016,"Action, Crime, Drama",A reclusive pawn shop owner sets his sights on revenge when vicious gangsters kidnap his drug-addicted neighbor's young daughter.,Nishikant Kamat,"John Abraham, Nishikant Kamat, Sharad Kelkar, Teddy Maurya",https://m.media-amazon.com/images/M/MV5BNTc3ZjBlNTctZmMwOC00YmZhLTg3ZDItOWIzN2U3ZDBmZGUzXkEyXkFqcGc@._V1_.jpg,6.8,9029
561,tt0845448,Dhamaal,2007,"Action, Adventure, Comedy","Four lazy slacker conmen buddies who are jobless, homeless and broke learn about the secret of a hidden treasure from a dying thief and later embark on a race against time to find the mobster's buried treasure and claim it while being pursued by a determined police inspector who is hellbent to get the treasure all by himself.",Indra Kumar,"Sanjay Dutt, Riteish Deshmukh, Arshad Warsi, Jaaved Jaaferi",https://m.media-amazon.com/images/M/MV5BZWU3OTEzODgtMWY4OS00N2NkLWJlNGQtMWZhZDJmODQwN2E5XkEyXkFqcGc@._V1_.jpg,7.5,19195
562,tt4430136,Pyaar Ka Punchnama 2,2015,"Comedy, Drama, Romance","After falling in love, three roommates experience changes in their lives.",Luv Ranjan,"Kartik Aaryan, Omkar Kapoor, Sunny Singh, Nushrratt Bharuccha",https://m.media-amazon.com/images/M/MV5BMTcxNDY5NjA5NV5BMl5BanBnXkFtZTgwNjcyMTk5NjE@._V1_.jpg,7.2,16337
563,tt15482442,Untitled Blumhouse Productions Film,2024, ,Add a Plot,Luv Ranjan,"Kartik Aaryan, Omkar Kapoor, Sunny Singh, Nushrratt Bharuccha",Not Available,,
564,tt0233422,Chachi 420,1997,"Comedy, Drama, Family",Desperation to be with his only child forces a divorced man to take the guise of the child's nanny. Situations get really messy when the child's grandfather (the man's ex-father-in-law) falls in love with his disguised ex-son-in-law.,Kamal Haasan,"Kamal Haasan, Amrish Puri, Om Puri, Tabu",https://m.media-amazon.com/images/M/MV5BNTFmZjczODYtZTlmMy00N2FmLWE1NjEtNzZkMzgwODMxMzUzXkEyXkFqcGc@._V1_.jpg,7.4,13904
565,tt0346723,Chalte Chalte,2003,"Drama, Romance",A man pursues a woman who is already engaged and eventually gets married to her. Differences between the two lead to a bitter separation that threatens to destroy their relationship forever.,Aziz Mirza,"Shah Rukh Khan, Rani Mukerji, Jas Arora, Satish Shah",https://m.media-amazon.com/images/M/MV5BYzU4MjI2MjctMzExMC00NTAxLWFjZWMtODk2YzVjMzhkZmU2XkEyXkFqcGdeQXVyODE5NzE3OTE@._V1_.jpg,6.5,16726
566,tt5255710,Sanam Teri Kasam,2016,"Drama, Musical, Romance","After being disowned by her family, an awkward librarian relies on the help of her brooding neighbour.","Radhika Rao, Vinay Sapru","Harshvardhan Rane, Mawra Hocane, Vijay Raaz, Murli Sharma",https://m.media-amazon.com/images/M/MV5BYTJmYmI0YWQtYjI3MC00MWU4LWI2OTQtNDYyOGEyNThjZjg3XkEyXkFqcGc@._V1_.jpg,7.6,20965
567,tt0448206,Bunty Aur Babli,2005,"Comedy, Crime, Drama","A small-town pair become the legendary Bunty and Babli, turning the world on its head caper after caper--until they meet a very upset police officer.",Shaad Ali,"Abhishek Bachchan, Rani Mukerji, Amitabh Bachchan, Kiran Juneja",https://m.media-amazon.com/images/M/MV5BOGQ1MjI3YjEtYzFlMC00NTFhLTllZGUtZWMzMTBiOGQxMjRkXkEyXkFqcGc@._V1_.jpg,6.2,8214
568,tt1395025,Agent Vinod,2012,"Action, Adventure, Thriller",A series of seemingly unconnected events across the world leads to Agent Vinod undertaking a globe-trotting mission to discover why his colleague was murdered.,Sriram Raghavan,"Kareena Kapoor, Saif Ali Khan, Adil Hussain, Ram Kapoor",https://m.media-amazon.com/images/M/MV5BNTUwODA5MGEtMjQ0NS00ZGM4LWJiYjItZTZjNzI4OTBlZThhXkEyXkFqcGc@._V1_.jpg,5.2,8232
569,tt4387040,Airlift,2016,"Action, Drama, History","When Iraq invades Kuwait in August 1990, a callous Indian businessman becomes the spokesperson for more than 170,000 stranded countrymen.",Raja Menon,"Akshay Kumar, Nimrat Kaur, Kumud Mishra, Prakash Belawadi",https://m.media-amazon.com/images/M/MV5BYjNjMGEzNTUtOTJmMC00OGJkLThhOWYtZmUzYTk3ZWY4MmVmXkEyXkFqcGc@._V1_.jpg,7.9,58813
