Serial No,movie_id,movie_name,year,genre,overview,director,cast,poster_url,rating,votes
0,tt15354916,Jawan,2023,"Action, Thriller",A high-octane action thriller which outlines the emotional journey of a man who is set to rectify the wrongs in the society.,Atlee,"Shah Rukh Khan, Nayanthara, Vijay Sethupathi, Deepika Padukone",https://m.media-amazon.com/images/M/MV5BOWI5NmU3NTUtOTZiMS00YzA1LThlYTktNDJjYTU5NDFiMDUxXkEyXkFqcGdeQXVyMTUzNjEwNjM2._V1_.jpg,7,94984
1,tt15748830,Jaane Jaan,2023,"Crime, Drama, Mystery",A single mother and her daughter who commit a crime and a neighbor who helps them cover it up amidst a police investigation.,Sujoy Ghosh,"Kareena Kapoor, Jaideep Ahlawat, Vijay Varma, Saurabh Sachdeva",https://m.media-amazon.com/images/M/MV5BMTNmMmY5NzAtNTdjOC00Y2JiLThjZDQtNDEzODQ5MWQ4NWFhXkEyXkFqcGdeQXVyODE5NzE3OTE@._V1_.jpg,7,13849
2,tt11663228,Jailer,2023,"Action, Comedy, Crime","A retired jailer goes on a manhunt to find his son's killers. But the road leads him to a familiar, albeit a bit darker place. Can he emerge from this complex situation successfully?",Nelson Dilipkumar,"Rajinikanth, Mohanlal, Shivarajkumar, Jackie Shroff",https://m.media-amazon.com/images/M/MV5BNzFkNmZkMTctYjRhMS00ODZiLWFlNjQtZmZmN2IzMDJlNmVkXkEyXkFqcGdeQXVyMTY1MzAyNjU4._V1_.jpg,7.1,34871
3,tt14993250,Rocky Aur Rani Kii Prem Kahaani,2023,"Comedy, Drama, Family","Flamboyant Punjabi Rocky and intellectual Bengali journalist Rani fall in love despite their differences. After facing family opposition, they decide to live with each other's families for three months before getting married.",Karan Johar,"Ranveer Singh, Alia Bhatt, Dharmendra, Shabana Azmi",https://m.media-amazon.com/images/M/MV5BNzAyOWQ4MjUtMGNkMi00ODBkLWEyZDgtY2Q0YjJhYjg3MzNlXkEyXkFqcGdeQXVyMTUxMTM3OTc1._V1_.jpg,6.5,42764
4,tt15732324,OMG 2,2023,"Comedy, Drama",An unhappy civilian asks the court to mandate comprehensive education in schools in a dramatic yet amusing courtroom play.,Amit Rai,"Pankaj Tripathi, Akshay Kumar, Yami Gautam, Pawan Malhotra",https://m.media-amazon.com/images/M/MV5BNmQ3MThkOWEtNTA0NC00YzI2LWIxZjEtZjdlZTVmNzQ2ZGViXkEyXkFqcGdeQXVyODE5NzE3OTE@._V1_.jpg,7.6,41322
5,tt18266472,Sukhee,2023,Drama,"Much to the dismay of her husband, a middle-class housewife, known for her rebellious attitude in high school, decides to attend her class reunion.",Sonal Joshi,"Shilpa Shetty Kundra, Amit Sadh, Chaitannya Choudhry, Kusha Kapila",https://m.media-amazon.com/images/M/MV5BZTdmODZjNDUtYmM2MS00OGQ5LTllZDAtNTlmMWU5ZjRlZGFiXkEyXkFqcGc@._V1_.jpg,5.9,8234
6,tt18561736,The Great Indian Family,2023,Family,"Ved Vyas Tripathi, aka Bhajan Kumar, is a devout Hindu man who faces an identity crisis and a personal dilemma when he discovers he is actually a Muslim by birth.",Vijay Krishna Acharya,"Alka Amin, Bhuvan Arora, Manushi Chhillar, Srishti Dixit",https://m.media-amazon.com/images/M/MV5BMjY5Mzg4MTMtNjFkOS00NTA3LTk3NTQtNzdmNzlkOTJjZDZkXkEyXkFqcGc@._V1_.jpg,5.6,6969
7,tt3691740,The BFG,2016,"Adventure, Family, Fantasy","An orphan little girl befriends a benevolent giant who takes her to Giant Country, where they attempt to stop the man-eating giants that are invading the human world.",Steven Spielberg,"Mark Rylance, Ruby Barnhill, Penelope Wilton, Jemaine Clement",https://m.media-amazon.com/images/M/MV5BNjAzOTUzNTY3Ml5BMl5BanBnXkFtZTgwMjYwNzE5ODE@._V1_.jpg,6.3,93345
8,tt12844910,Pathaan,2023,"Action, Adventure, Thriller","An Indian agent races against a doomsday clock as a ruthless mercenary, with a bitter vendetta, mounts an apocalyptic attack against the country.",Siddharth Anand,"Shah Rukh Khan, Deepika Padukone, John Abraham, Dimple Kapadia",https://m.media-amazon.com/images/M/MV5BYTgzNjBjYTctOGJiZi00MTliLTk0YzYtNDJmYTQyMDdkMjQ5XkEyXkFqcGdeQXVyNTkzNDQ4ODc@._V1_.jpg,5.8,156522
9,tt15464390,Mastaney,2023,"Action, Drama, History","Set in 1739, Nadar Shah's undefeated army was attacked by Sikh Rebellions. Nadar demands to arrest them but it doesn't work out. Five ordinary men are hired to play Sikh Rebellions but over time they learn what Sikhs are.",Sharan Art,"Tarsem Jassar, Simi Chahal, Gurpreet Ghuggi, Karamjit Anmol",https://m.media-amazon.com/images/M/MV5BMjJjZmU2ZjEtYTQxZS00M2M1LTg5YTUtOTMyODFhZmZlYzc1XkEyXkFqcGc@._V1_.jpg,7.4,5465
10,tt1187043,3 Idiots,2009,"Comedy, Drama","Two friends are searching for their long lost companion. They revisit their college days and recall the memories of their friend who inspired them to think differently, even as the rest of the world called them ""idiots"".",Rajkumar Hirani,"Aamir Khan, Madhavan, Mona Singh, Sharman Joshi",https://m.media-amazon.com/images/M/MV5BNTkyOGVjMGEtNmQzZi00NzFlLTlhOWQtODYyMDc2ZGJmYzFhXkEyXkFqcGdeQXVyNjU0OTQ0OTY@._V1_.jpg,8.4,435162
11,tt14914988,Satyaprem Ki Katha,2023,"Comedy, Drama, Musical","A middle-class boy in Ahmedabad, Satyaprem falling in one-sided love with Katha, who is coping with her breakup with Tapan. Through the journey, they discover each other's life and complement in accomplishing what was left halfway.",Sameer Vidwans,"Kartik Aaryan, Kiara Advani, Supriya Pathak, Gajraj Rao",https://m.media-amazon.com/images/M/MV5BMTVmZDNjMGEtNzc5MC00ODY4LWI1ZTYtMjM2ODhhNGExNzgxXkEyXkFqcGc@._V1_.jpg,6.7,30861
12,tt3741834,Lion,2016,"Biography, Drama","A five-year-old Indian boy is adopted by an Australian couple after getting lost hundreds of kilometers from home. 25 years later, he sets out to find his lost family.",Garth Davis,"Dev Patel, Nicole Kidman, Rooney Mara, Sunny Pawar",https://m.media-amazon.com/images/M/MV5BMjA3NjkzNjg2MF5BMl5BanBnXkFtZTgwMDkyMzgzMDI@._V1_.jpg,8,251458
13,tt13131610,Bholaa Shankar,2023,"Action, Drama",A doting brother tries to hunt down notorious criminals who had harmed his sister.,Meher Ramesh,"Chiranjeevi, Tamannaah Bhatia, Keerthy Suresh, Raghu Babu",https://m.media-amazon.com/images/M/MV5BYzNjMGYzMmEtYTkzYS00MGE3LThkMTEtYTM2MjM0ZTdjZmYxXkEyXkFqcGdeQXVyMTcyNDY1NDgw._V1_.jpg,3.3,2092
14,tt22188452,Haddi,2023,"Crime, Drama","In this ZEE5 Original film, a transgender, Haddi moves to Delhi and joins a gang of transgenders and cross-dressers headed by an influential man. But is this move aspirational or driven by revenge?",Akshat Ajay Sharma,"Nawazuddin Siddiqui, Anurag Kashyap, Mohd. Zeeshan Ayyub, Resh Lamba",https://m.media-amazon.com/images/M/MV5BYWQ2YjAyMWQtNTRkZS00MzAxLWI4ZTMtNzk1ZDVlMDczNjFkXkEyXkFqcGc@._V1_.jpg,5.5,5041
15,tt28568397,Friday Night Plan,2023,"Comedy, Drama","When their mother takes off on a business trip, two bickering brothers unite to secretly attend the hottest party of the year before she returns.",Vatsal Neelakantan,"Babil Khan, Amrith Jayan, Medha Rana, Aadhya Anand",https://m.media-amazon.com/images/M/MV5BN2FlMzA3MjktNjA2Zi00YzUyLWIxYTUtNGQ0MTc0NDA3NTcwXkEyXkFqcGdeQXVyODE5NzE3OTE@._V1_.jpg,6.5,1920
16,tt21908676,Neeyat,2023,"Crime, Mystery, Thriller","When a mysterious murder takes place at exiled billionaire Ashish Kapoor's birthday getaway, detective Mira Rao must use all her skill to unravel devious motives as the suspects are Kapoor's close family and friends.",Anu Menon,"Vidya Balan, Ram Kapoor, Rahul Bose, Neeraj Kabi",https://m.media-amazon.com/images/M/MV5BZTNiZTIxZGUtMjZiNC00NzJjLTlhMDItMDA3YzUwMjUwMDBhXkEyXkFqcGc@._V1_.jpg,5.3,4819
17,tt15441054,Gadar 2,2023,"Action, Adventure, Drama","When Tara Singh goes missing during a skirmish and is believed to be captured in Pakistan, his son Jeete sets out to rescue him and enters a labyrinth from which they both must escape at all costs.",Anil Sharma,"Sunny Deol, Amrish Puri, Nana Patekar, Ameesha Patel",https://m.media-amazon.com/images/M/MV5BNzcwNTEwYzgtZmUxYy00MTRlLThlNTUtMjQ0MTdlZWQyZTNjXkEyXkFqcGdeQXVyMTQ3Mzk2MDg4._V1_.jpg,5.1,22298
18,tt27542289,Por Thozhil,2023,"Action, Crime, Thriller",A bright but faint-hearted rookie cop has to overcome his fears in order to succeed in his first case which sees him partnered with a reclusive senior officer to catch a serial killer on the loose.,"Vignesh Raja, T. Senthil Paramasivam","R. Sarathkumar, Ashok Selvan, Nikhila Vimal, Sarath Babu",https://m.media-amazon.com/images/M/MV5BNjc1MDA2ZTgtYzkyMC00ZTcwLWEwNmUtYjM1MmZhYTc3YzgzXkEyXkFqcGc@._V1_.jpg,8,11369
19,tt0454876,Life of Pi,2012,"Adventure, Drama, Fantasy","A young man who survives a disaster at sea is hurtled into an epic journey of adventure and discovery. While cast away, he forms an unexpected connection with another survivor: a fearsome Bengal tiger.",Ang Lee,"Suraj Sharma, Irrfan Khan, Adil Hussain, Tabu",https://m.media-amazon.com/images/M/MV5BNTg2OTY2ODg5OF5BMl5BanBnXkFtZTcwODM5MTYxOA@@._V1_.jpg,7.9,667513
20,tt0249371,Asoka,2001,"Action, Biography, Drama",The epic tale of King Asoka's life is recounted.,Santosh Sivan,"Shah Rukh Khan, Kareena Kapoor, Danny Denzongpa, Hrishitaa Bhatt",https://m.media-amazon.com/images/M/MV5BNjk3OTZmYWUtMDYwMy00Y2ZmLWEzMDYtOTg3YjQzNDNkM2E1XkEyXkFqcGdeQXVyODE5NzE3OTE@._V1_.jpg,6.4,15534
21,tt0838221,The Darjeeling Limited,2007,"Adventure, Comedy, Drama","A year after their father's funeral, three brothers travel across India by train in an attempt to bond with each other.",Wes Anderson,"Owen Wilson, Adrien Brody, Jason Schwartzman, Amara Karan",https://m.media-amazon.com/images/M/MV5BMTM0MTQ4MTgwOF5BMl5BanBnXkFtZTcwMDA3MDU1MQ@@._V1_.jpg,7.2,217143
22,tt5074352,Dangal,2016,"Action, Biography, Drama",Former wrestler Mahavir Singh Phogat and his two wrestler daughters struggle towards glory at the Commonwealth Games in the face of societal oppression.,Nitesh Tiwari,"Aamir Khan, Sakshi Tanwar, Fatima Sana Shaikh, Sanya Malhotra",https://m.media-amazon.com/images/M/MV5BMTQ4MzQzMzM2Nl5BMl5BanBnXkFtZTgwMTQ1NzU3MDI@._V1_.jpg,8.3,212856
23,tt8239946,Tumbbad,2018,"Drama, Fantasy, Horror",A mythological story about a goddess who created the entire universe. The plot revolves around the consequences when humans build a temple for her first-born.,"Rahi Anil Barve, Anand Gandhi, Adesh Prasad","Sohum Shah, Jyoti Malshe, Anita Date-Kelkar, Ronjini Chakraborty",https://m.media-amazon.com/images/M/MV5BOTY0YzY3MTMtOWQ5Yi00ODY2LThhOGMtMzFlMjhlODcxOGU1XkEyXkFqcGc@._V1_.jpg,8.2,60626
24,tt15428134,Dunki,2023,"Comedy, Drama",The rampant use of an illegal backdoor route called 'Donkey Flight' by Indians to immigrate to countries like Canada and USA.,Rajkumar Hirani,"Shah Rukh Khan, Taapsee Pannu, Boman Irani, Vicky Kaushal",https://m.media-amazon.com/images/M/MV5BMzQ0NDRhNmItYzllYS00NDdlLTk0YTctZDQ5YmFkYjdkNDcyXkEyXkFqcGdeQXVyNTYwMzA0MTM@._V1_.jpg,6.6,73747
25,tt24485052,Sirf Ek Bandaa Kaafi Hai,2023,"Crime, Drama, Thriller",A common man with honesty and integrity can take on the system when he has truth on his side.,Apoorv Singh Karki,"Manoj Bajpayee, Surya Mohan Kulshreshtha, Jai Hind Kumar, Nikhil Pandey",https://m.media-amazon.com/images/M/MV5BODZiODQyZjgtNTdiZC00OTFhLTkwODktMjFmODJlZjk5MzYzXkEyXkFqcGdeQXVyMTQwMTI5NzM2._V1_.jpg,8,29384
26,tt1954470,Gangs of Wasseypur,2012,"Action, Comedy, Crime","A clash between Sultan and Shahid Khan leads to the expulsion of Khan from Wasseypur, and ignites a deadly blood feud spanning three generations.",Anurag Kashyap,"Manoj Bajpayee, Nawazuddin Siddiqui, Tigmanshu Dhulia, Richa Chadha",https://m.media-amazon.com/images/M/MV5BMTc5NjY4MjUwNF5BMl5BanBnXkFtZTgwODM3NzM5MzE@._V1_.jpg,8.2,103934
27,tt15433600,Khufiya,2023,"Action, Biography, Crime","Krishna Mehra who is an operative at Indian spy agency known as R&AW. She is assigned to track down the mole selling India's defense secrets, while all along grappling with her dual identity as a spy and a lover.",Vishal Bhardwaj,"Tabu, Ali Fazal, Wamiqa Gabbi, Azmeri Haque Badhon",https://m.media-amazon.com/images/M/MV5BNWYzMWFhYmQtNmI0Ni00OWJkLWFiMjktM2JlZmEzZjgzNjE1XkEyXkFqcGdeQXVyODE5NzE3OTE@._V1_.jpg,6.1,6940
28,tt13751694,Animal,2023,"Action, Crime, Drama","Animal is the story of a son's obsessive love for his father. Often away due to work the father is unable to comprehend the intensity of his son's love. Ironically, this fervent love and ...                See full summary »",Sandeep Reddy Vanga,"Ranbir Kapoor, Triptii Dimri, Saurabh Sachdeva, Anil Kapoor",https://m.media-amazon.com/images/M/MV5BNGViM2M4NmUtMmNkNy00MTQ5LTk5MDYtNmNhODAzODkwOTJlXkEyXkFqcGdeQXVyMTY1NDY4NTIw._V1_.jpg,6.2,90087
29,tt15891388,Miss Shetty Mr Polishetty,2023,"Comedy, Drama, Romance","Miss Shetty is a feminist living in London and wants to be single forever. Mr. Polishetty from Hyderabad in Telangana, India, wants to be in a committed relationship. The two appear to be in different stages of life but somehow connect.",Mahesh Babu P.,"Keshav Deepak, Abhinav Gomatam, Jayasudha, Koushik Mahata",https://m.media-amazon.com/images/M/MV5BNTkzOWYzNjktNGJiMi00NTE3LTgyZGYtZDc4MTZiODlhMGJiXkEyXkFqcGc@._V1_.jpg,7,4645
30,tt19755170,Bawaal,2023,"Action, Drama, Romance",A small-town man who falls in love with the most beautiful girl in town. He wants to marry her one day because marrying her can raise his social position.,Nitesh Tiwari,"Varun Dhawan, Janhvi Kapoor, Manoj Pahwa, Anjuman Saxena",https://m.media-amazon.com/images/M/MV5BMDI5NTBkYjItNjYzZS00ZjE0LWE2MTktY2QyMWEwYjk3ZTNlXkEyXkFqcGc@._V1_.jpg,6.6,16365
31,tt6277462,Brahmastra Part One: Shiva,2022,"Action, Adventure, Fantasy","A DJ with superpowers and his ladylove embark on a mission to protect the Brahmastra, a weapon of enormous energy, from dark forces closing in on them.",Ayan Mukerji,"Amitabh Bachchan, Ranbir Kapoor, Alia Bhatt, Nagarjuna Akkineni",https://m.media-amazon.com/images/M/MV5BNDlhMjZlY2YtZTA1MC00MzQwLTg2ZGUtNWVjNzczOGMwOWZjXkEyXkFqcGdeQXVyMTYyNjAzOTUx._V1_.jpg,5.6,111668
32,tt20913276,Ghoomer,2023,"Drama, Sport","Anina, a young batting prodigy, loses her right hand in an accident. An unsympathetic, failed cricketer gives her new hope, trains her with unconventional techniques, to turn her fate around. Ghoomer is a new style of bowling they invent.",R. Balki,"Amitabh Bachchan, Shabana Azmi, Abhishek Bachchan, Saiyami Kher",Not Available,,
33,tt18411490,Tiger 3,2023,"Action, Adventure, Thriller",Plot under wraps,Maneesh Sharma,"Salman Khan, Katrina Kaif",https://m.media-amazon.com/images/M/MV5BYzQwMGZlYTUtODUwNi00ZjQxLWEzODAtZGU3Zjc0MmNhMzhkXkEyXkFqcGdeQXVyNTkzNDQ4ODc@._V1_.jpg,5.7,53196
34,tt8672856,Tu Jhoothi Main Makkaar,2023,"Comedy, Romance","Madness ensues when a 'player' in the world of romantic relationships finds a girl who's a worthy opponent, that believes love is a battle of wits.",Luv Ranjan,"Ranbir Kapoor, Shraddha Kapoor, Krrish Saini, Anubhav Singh Bassi",https://m.media-amazon.com/images/M/MV5BNmZmYWFiYzAtY2RhMC00MDRiLWI1M2YtNzRkZGNmYTIwZDI4XkEyXkFqcGdeQXVyODE5NzE3OTE@._V1_.jpg,6,28013
35,tt15501640,Drishyam 2,2022,"Crime, Drama, Mystery",A gripping tale of an investigation and a family which is threatened by it. Will Vijay Salgaonkar be able to protect his family this time?,Abhishek Pathak,"Ajay Devgn, Akshaye Khanna, Tabu, Shriya Saran",https://m.media-amazon.com/images/M/MV5BYmY2ZDUxNzUtYWZlYy00MThhLWI5NjktZDhjZTU3MDY5YTM3XkEyXkFqcGdeQXVyNTYxMDgzODI@._V1_.jpg,8.2,45288
36,tt0083987,Gandhi,1982,"Biography, Drama, History",The life of the lawyer who became the famed leader of the Indian revolts against the British rule through his philosophy of nonviolent protest.,Richard Attenborough,"Ben Kingsley, John Gielgud, Rohini Hattangadi, Roshan Seth",https://m.media-amazon.com/images/M/MV5BNTg3ODhlZTEtM2Q3MC00YzMxLWJjN2YtOWUyMDIyYTlhYzM3XkEyXkFqcGc@._V1_.jpg,8,240303
37,tt2338151,PK,2014,"Comedy, Drama, Sci-Fi",An alien on Earth loses the only device he can use to communicate with his spaceship. His innocent nature and child-like questions force the country to evaluate the impact of there religious views on there people.,Rajkumar Hirani,"Aamir Khan, Anushka Sharma, Sanjay Dutt, Boman Irani",https://m.media-amazon.com/images/M/MV5BMTg5NzIzMzEyOF5BMl5BanBnXkFtZTgwMjgzMTg0MzE@._V1_.jpg,8.1,201504
38,tt1188996,My Name Is Khan,2010,"Adventure, Drama, Romance",An Indian Muslim man with Asperger's syndrome takes a challenge to speak to the President of the United States seriously and embarks on a cross-country journey.,Karan Johar,"Shah Rukh Khan, Kajol, Sheetal Menon, Katie Amanda Keane",https://m.media-amazon.com/images/M/MV5BMTUyMTA4NDYzMV5BMl5BanBnXkFtZTcwMjk5MzcxMw@@._V1_.jpg,7.9,116464
39,tt3405236,Raees,2017,"Action, Crime, Drama",A bootlegger sets out to improve his community as a promising leader but falls in a political trap.,Rahul Dholakia,"Shah Rukh Khan, Jaideep Ahlawat, Sunny Leone, Nawazuddin Siddiqui",https://m.media-amazon.com/images/M/MV5BMTc2NTYwMTE1NV5BMl5BanBnXkFtZTgwODQ5MzAwMTI@._V1_.jpg,6.6,50726
40,tt26324936,Rama Banam,2023,"Action, Drama","Two siblings, who despite their difference in ideologies come together to fight for their common goal.",Sriwass,"Gopichand, Dimple Hayathi, Jagapathi Babu, Kushboo",https://m.media-amazon.com/images/M/MV5BZTI5ZTFmOGItZjZlNi00Mjg1LWEwNDgtZDI2ZjJkMjU4ODU1XkEyXkFqcGc@._V1_.jpg,4.2,663
41,tt8108198,Andhadhun,2018,"Crime, Mystery, Thriller","A series of mysterious events change the life of a blind pianist, who must now report a crime that he should technically know nothing of.",Sriram Raghavan,"Tabu, Ayushmann Khurrana, Radhika Apte, Anil Dhawan",https://m.media-amazon.com/images/M/MV5BZWZhMjhhZmYtOTIzOC00MGYzLWI1OGYtM2ZkN2IxNTI4ZWI3XkEyXkFqcGdeQXVyNDAzNDk0MTQ@._V1_.jpg,8.2,104624
42,tt23036080,Thank You for Coming,2023,Comedy,"When five best friends assemble together at a family gathering, they must navigate the hilarious and heartwarming consequences of their lie, discovering the true depth of their friendship and love.",Karan Boolani,"Bhumi Pednekar, Dolly Ahluwalia, Shibani Bedi, Saloni Daini",https://m.media-amazon.com/images/M/MV5BOWMxOTQyNzItOWJmNi00NmI0LWFiNjItZWY2YjRlMzk1M2I0XkEyXkFqcGdeQXVyODE5NzE3OTE@._V1_.jpg,4.1,8516
43,tt22086334,Dream Girl 2,2023,"Comedy, Drama, Romance","Karam, who is trying to live a serious life in Mathura and falls in love with Pari but life is hell bent on not taking him seriously. In a turn of events Karam becomes Pooja which creates further chaos in his already chaotic life.",Raaj Shaandilyaa,"Paresh Rawal, Ananya Panday, Ayushmann Khurrana, Annu Kapoor",https://m.media-amazon.com/images/M/MV5BZGI3OTFkMTYtOGRlNC00NzRiLThlNWEtOGU0YzdkYWRiOWU0XkEyXkFqcGdeQXVyODE5NzE3OTE@._V1_.jpg,5.2,11428
44,tt15380630,Kushi,2023,"Comedy, Drama, Romance","Raised in an atheist household, a young man falls in love with the daughter of his father's arch-rival, a devout Hindu leader.",Shiva Nirvana,"Samantha Ruth Prabhu, Vijay Deverakonda, Lakshmi, Murli Sharma",https://m.media-amazon.com/images/M/MV5BY2Q1YzlhODEtNWRiZS00ZGJkLWJlMzgtMTE2NmIyYzg5ODg1XkEyXkFqcGc@._V1_.jpg,5.4,8422
45,tt0986264,Taare Zameen Par,2007,"Drama, Family","An eight-year-old boy is thought to be a lazy trouble-maker, until the new art teacher has the patience and compassion to discover the real problem behind his struggles in school.","Aamir Khan, Amole Gupte","Darsheel Safary, Aamir Khan, Tanay Chheda, Sachet Engineer",https://m.media-amazon.com/images/M/MV5BMDhjZWViN2MtNzgxOS00NmI4LThiZDQtZDI3MzM4MDE4NTc0XkEyXkFqcGdeQXVyMTMxODk2OTU@._V1_.jpg,8.3,208133
46,tt4430212,Drishyam,2015,"Crime, Drama, Mystery","Desperate measures are taken by a man who tries to save his family from the dark side of the law, after they commit an unexpected crime.",Nishikant Kamat,"Ajay Devgn, Shriya Saran, Tabu, Rajat Kapoor",https://m.media-amazon.com/images/M/MV5BYmJhZmJlYTItZmZlNy00MGY0LTg0ZGMtNWFkYWU5NTA1YTNhXkEyXkFqcGdeQXVyODE5NzE3OTE@._V1_.jpg,8.2,95789
47,tt22297828,Chor Nikal Ke Bhaga,2023,"Crime, Drama, Thriller","A flight attendant and her business partner on a mission to steal diamonds and free themselves from the clutches of a loan shark.At 40,000 feet in the air, the heist goes horribly wrong and turns into a hostage situation.",Ajay Singh,"Yami Gautam, Sunny Kaushal, Sharad Kelkar, Indraneil Sengupta",https://m.media-amazon.com/images/M/MV5BNzQxNDU3ZGMtM2JkZS00MGQ0LThjNjAtMTQ0NmJmMmZhNTg3XkEyXkFqcGdeQXVyODE5NzE3OTE@._V1_.jpg,7.2,54103
48,tt10083340,Gangubai Kathiawadi,2022,"Biography, Crime, Drama","Duped and sold to a brothel, a young woman fearlessly reclaims her power, using underworld connections to preside over the world she was once a pawn in.",Sanjay Leela Bhansali,"Alia Bhatt, Shantanu Maheshwari, Vijay Raaz, Indira Tiwari",https://m.media-amazon.com/images/M/MV5BN2M4NDM2NDItMzgzNy00OWRiLThhNjEtZDA2OWMyNTcwYzRjXkEyXkFqcGdeQXVyMTI1NDEyNTM5._V1_.jpg,7.8,61849
49,tt27012110,Gaslight,2023,"Crime, Horror, Mystery","Misha returns to her royal family estate after 15 years to visit her estranged father, only to find him missing.",Pavan Kirpalani,"Sara Ali Khan, Vikrant Massey, Chitrangda Singh, Rahul Dev",https://m.media-amazon.com/images/M/MV5BODFlZjg5YmQtOTYwMy00M2YwLThhYzktM2U3Y2I0MmRhZmRkXkEyXkFqcGc@._V1_.jpg,5.8,25548
50,tt15245240,The Buckingham Murders,2023,Thriller,"Follows Jass, a detective-mother who after losing her own child must investigate the murder of a 10-year-old in Buckinghamshire, going down a rabbit hole of secrets, where almost everyone in the small town becomes a suspect.",Hansal Mehta,"Kareena Kapoor, Keith Allen, Haqi Ali, Chris Wilson",https://m.media-amazon.com/images/M/MV5BOTQwMWE3ZTEtMWRiYi00NDE3LTllMGEtZWNmYzhlOGI3YmNlXkEyXkFqcGc@._V1_.jpg,6.3,8192
51,tt13818368,Fighter,2024,"Action, Adventure, Thriller","FIGHTER is India's first aerial action film releasing in theaters on 25th January, 2024.",Siddharth Anand,"Hrithik Roshan, Deepika Padukone, Anil Kapoor, Akarsh Alagh",https://m.media-amazon.com/images/M/MV5BZjkwN2Q5Y2QtMmE2MC00NzlkLTg2NzQtYjVjYjVmNjE2ZTNiXkEyXkFqcGdeQXVyODE5NzE3OTE@._V1_.jpg,6.2,44202
52,tt15302222,Bholaa,2023,"Action, Adventure, Crime","After getting out of prison with the desire to meet his daughter, Bholaa's plans are interrupted by a well-orchestrated drug bust.",Ajay Devgn,"Ajay Devgn, Tabu, Abhishek Bachchan, Amala Paul",https://m.media-amazon.com/images/M/MV5BNTI1NGI5ZTItZjJhNC00NDQyLWE1YmMtMTMwZmJiNTNjYWZjXkEyXkFqcGdeQXVyNDYwMjI1MzI@._V1_.jpg,5.8,22515
53,tt1024943,Om Shanti Om,2007,"Action, Comedy, Drama","In the 1970s, Om, an aspiring actor, is murdered, but is immediately reincarnated into the present day. He attempts to discover the mystery of his demise and find Shanti, the love of his previous life.",Farah Khan,"Shah Rukh Khan, Deepika Padukone, Arjun Rampal, Kirron Kher",https://m.media-amazon.com/images/M/MV5BZTgyNWUxNjItYTgxNi00ZDMzLThiMGItYjVlMjQ4NzkzOThlXkEyXkFqcGc@._V1_.jpg,6.8,49835
54,tt0248126,Kabhi Khushi Kabhie Gham...,2001,"Drama, Musical, Romance","After marrying a poor woman, rich Rahul is disowned by his father and moves to London to build a new life. Years later, his now-grown younger brother Rohan embarks on a mission to bring Rahul back home and reunite the family.",Karan Johar,"Shah Rukh Khan, Kajol, Amitabh Bachchan, Hrithik Roshan",https://m.media-amazon.com/images/M/MV5BOTQ5Nzc3NzAtMzZlMS00ZWJjLWIxMGMtNDU4ZTQ1NmNjMjc5XkEyXkFqcGdeQXVyODE5NzE3OTE@._V1_.jpg,7.4,55735
55,tt24268454,The Kerala Story,2023,Drama,"A converted Muslim woman Fatima Ba narrates her ordeal of how she once wanted to become a nurse but was abducted from her home and manipulated by religious vanguards, turned into an ISIS terrorist and landed in Afghanistan jail.","Sudipto Sen, Vipul Amrutlal Shah","Adah Sharma, Yogita Bihani, Sonia Balani, Siddhi Idnani",https://m.media-amazon.com/images/M/MV5BNmRlZmY4OTQtOTlkZC00NzAyLWJmNmItNDM4ODdjZWJkOTMwXkEyXkFqcGc@._V1_.jpg,6.9,73683
56,tt13131350,Vikram Vedha,2022,"Action, Crime, Drama",A tough police officer sets out to track down and kill an equally tough gangster.,"Gayatri, Pushkar","Saif Ali Khan, Hrithik Roshan, Radhika Apte, Rohit Saraf",https://m.media-amazon.com/images/M/MV5BYjc2YjVhNWQtYzVmZC00YzAyLTljNTItMmUxMTk1NjcyMThhXkEyXkFqcGc@._V1_.jpg,7.1,24371
57,tt0367110,"Swades: We, the People",2004,"Drama, Musical",A successful Indian scientist returns to an Indian village to take his nanny to America with him and in the process rediscovers his roots.,Ashutosh Gowariker,"Shah Rukh Khan, Gayatri Joshi, Kishori Ballal, Smith Seth",https://m.media-amazon.com/images/M/MV5BZWJlNmQ2NmQtM2U3Yi00MTZjLWI1YzktY2I2MmExMzgwNmE3XkEyXkFqcGc@._V1_.jpg,8.2,98603
58,tt3863552,Bajrangi Bhaijaan,2015,"Action, Adventure, Comedy",An Indian man with a magnanimous heart takes a young mute Pakistani girl back to her homeland to reunite her with her family.,"Kabir Khan, Mehmet Tutkun","Salman Khan, Harshaali Malhotra, Nawazuddin Siddiqui, Kareena Kapoor",https://m.media-amazon.com/images/M/MV5BYzVjMjZiNGUtZjZiNy00Yzg4LWEzYzYtMmI1NDg5NWNiNjUwXkEyXkFqcGc@._V1_.jpg,8.1,97863
59,tt27501039,Bloody Daddy,2023,"Action, Crime, Drama","A messed up, tenacious man faces off against cops and crime lords to save the one relationship that matters to him.",Ali Abbas Zafar,"Shahid Kapoor, Vivan Bhatena, Diana Penty, Ronit Roy",https://m.media-amazon.com/images/M/MV5BNTFlMzkyOTgtMTU0OS00MzkwLWIzMGQtMmI3ZTU2OGJjYWVjXkEyXkFqcGc@._V1_.jpg,6.6,22247
60,tt2980648,The Hundred-Foot Journey,2014,"Comedy, Drama",The Kadam family leaves India for France where they open a restaurant directly across the road from Madame Mallory's Michelin-starred eatery.,Lasse Hallström,"Helen Mirren, Om Puri, Manish Dayal, Charlotte Le Bon",https://m.media-amazon.com/images/M/MV5BMTQ3Mjg2MTE4M15BMl5BanBnXkFtZTgwMzcyNDMwMjE@._V1_.jpg,7.3,87675
61,tt10811166,The Kashmir Files,2022,Drama,"A heart-wrenching tale that captures the pain, suffering, and struggle of the Kashmiri Pandit community in 1990 and leads Krishna, a young college student, to set out on a quest to uncover the truth.",Vivek Agnihotri,"Mithun Chakraborty, Anupam Kher, Darshan Kumaar, Pallavi Joshi",https://m.media-amazon.com/images/M/MV5BYzJkZDIwYTAtMGU4Mi00NzU3LWI1MWItODg0M2Q1NmIxYmNlXkEyXkFqcGdeQXVyMTIyNzY0NTMx._V1_.jpg,8.6,573699
