Serial No,movie_id,movie_name,year,genre,overview,director,cast,poster_url,rating,votes
1083,tt0102846,Saugandh,1991,"Action, Drama, Romance","A woman whose entire family was murdered by a cruel landowner, vows that she will get her son and his daughter married someday.",Raj N. Sippy,"Rakhee Gulzar, Akshay Kumar, Shanti Priya, Aryeman Ramsay",https://m.media-amazon.com/images/M/MV5BZjI4ZmNmOWQtOTE5OS00ZTMwLTkzNGMtNGM0NmU4NWU3YjlkXkEyXkFqcGc@._V1_.jpg,5.4,1075
1084,tt0247911,Aap Mujhe Achche Lagne Lage,2002,"Action, Drama, Romance","The daughter of a rich criminal industrial tycoon falls in love with a college boy. The tycoon, what a surprise, objects...",Vikram Bhatt,"Hrithik Roshan, Ameesha Patel, Kiran Kumar, Mukesh Tiwari",https://m.media-amazon.com/images/M/MV5BNjNkMmYwNDgtMzM1My00Njc3LTg4NTMtNGM4MzA2YzlkNzEyXkEyXkFqcGc@._V1_.jpg,3.1,2804
1085,tt7777196,Thackeray,2019,"Biography, Drama","From controversial cartoonist to powerful Mumbai politician, this biopic maps the meteoric rise of far-right Shiv Sena party founder, Bal Thackeray.","Abhijit Panse, Amol Bhor","Nawazuddin Siddiqui, Amrita Rao, Prakash Belawadi, Nilesh Divekar",https://m.media-amazon.com/images/M/MV5BNTg4YzFlNDAtOGJkZC00NzI5LWI2OGItNmEzZTA0ZjFlNDJmXkEyXkFqcGc@._V1_.jpg,5.4,3812
1086,tt0187192,Julie,1975,"Family, Musical, Romance","Julie is an anglo-Indian girl with a loving, but alcoholic father and a domineering mother, a younger brother and sister. She falls in love with her best friend's brother Shashi ...                See full summary »",K.S. Sethumadhavan,"Lakshmi, Vikram Makandar, Nadira, Utpal Dutt",https://m.media-amazon.com/images/M/MV5BMTA2ODgxOGItMzJjMy00OGJiLTkyYjctMWNjZjJmNjczZjhiXkEyXkFqcGc@._V1_.jpg,6.2,314
1087,tt4486148,Shimla Mirchi,2020,"Comedy, Romance","While on holiday, Avi meets Naina and falls in love with her. Smitten, he decides to stay and work in her cafe. He confesses his love in a letter, however it's Naina's mother who mistakenly reads it.",Ramesh Sippy,"Hema Malini, Rajkummar Rao, Rakul Preet Singh, Shakti Kapoor",https://m.media-amazon.com/images/M/MV5BMjk3MzFkOGUtMDY4Ny00NzljLTliN2UtZGRhOGUxMTViYTc2XkEyXkFqcGdeQXVyMTA5NzIyMDY5._V1_.jpg,4.6,1792
1088,tt1806913,Golmaal Again,2017,"Action, Comedy, Fantasy",The gang encounters with some spiritual bodies and finds out the truth about the Jamnadas Orphanage where they were brought up.,Rohit Shetty,"Ajay Devgn, Arshad Warsi, Tabu, Shreyas Talpade",https://m.media-amazon.com/images/M/MV5BZDljYzk0MzgtY2ZlMi00MjQ1LTk0MzYtZGFiZjdiM2VkMWU3XkEyXkFqcGc@._V1_.jpg,5,10618
1089,tt13131186,Enemy,2021,"Action, Drama, Thriller",It's the story of two childhood friends and their escalating competitive nature. To what extent are they ready to go?,Anand Shankar,"Vishal, Arya, Mirnalini Ravi, Mamta Mohandas",https://m.media-amazon.com/images/M/MV5BZTA5ZTQwN2MtZGJlNi00MmMxLTk1MjAtMzBjNzRiMzY0NzEzXkEyXkFqcGc@._V1_.jpg,6.1,5043
1090,tt0050665,Madhumati,1958,"Fantasy, Musical, Mystery","A young man takes shelter in a mansion when a landslide blocks his route to the railway station. Then, he finds the mansion familiar and soon learns about the story of his previous birth.",Bimal Roy,"Dilip Kumar, Vyjayanthimala, Johnny Walker, Pran Sikand",https://m.media-amazon.com/images/M/MV5BNWM3OTEwYWUtZmFiMS00MjlhLTlmYjQtMTI4N2Q3NDIzNWFhXkEyXkFqcGc@._V1_.jpg,7.7,1654
1091,tt7981392,Kick 2,, ,Add a Plot,Jai Basantu Singh,"Salman Khan, Jacqueline Fernandez, Randeep Hooda, Akshaye Khanna",https://m.media-amazon.com/images/M/MV5BZTllNTI2ZWYtNzE1Yi00Y2IxLTlmMmYtOWMyZDA3N2Y0YmRkXkEyXkFqcGc@._V1_.jpg,,
1092,tt6078866,Soni,2018,"Crime, Drama","While fighting crimes against women in Delhi, a short-fused policewoman and her level-headed female boss grapple with gender issues in their own lives.",Ivan Ayr,"Geetika Vidya Ohlyan, Saloni Batra, Vikas Shukla, Mohit Chauhan",https://m.media-amazon.com/images/M/MV5BMzlkZDVjODAtYTQxMS00NGUyLWJlMWUtYjJhZmVlZjE5OWUyXkEyXkFqcGdeQXVyNjA3NzYzNzc@._V1_.jpg,7.1,3024
1093,tt0152256,Saagar,1985,"Drama, Romance","Raja, a fisherman is secretly in love with Mona. When wealthy Ravi comes to live with his grandmother, Kamladevi, he sees Mona and falls in love with her. Mona also reciprocates his love. ...                See full summary »",Ramesh Sippy,"Rishi Kapoor, Kamal Haasan, Dimple Kapadia, Nadira",https://m.media-amazon.com/images/M/MV5BYmY4MjM3ODUtMWIwNS00ZTFmLTljM2MtYzhlMWMzNmFmMDhhXkEyXkFqcGc@._V1_.jpg,6.9,1094
1094,tt0399942,Paap,2003,"Action, Crime, Drama",Kaya lives in a Buddhist village of Monks with her father who wants Kaya to devote her self to god and not live a normal like other females.The village head monk Lamha asks Kaya to travel ...                See full summary »,Pooja Bhatt,"John Abraham, Udita Goswami, Mohan Agashe, Gulshan Grover",https://m.media-amazon.com/images/M/MV5BMTAxOWE3YjQtMTkwMS00OGYwLTgyNjQtN2RmYWM1YzBjZDY4XkEyXkFqcGc@._V1_.jpg,5.2,936
1095,tt3309662,Jackpot,2013,"Comedy, Thriller",There are places in Goa where the rich can easily be fooled out of their money. A group of swindlers take advantage of this and risk everything just to get caught in a web of their own making.,Kaizad Gustad,"Naseeruddin Shah, Sunny Leone, Sachiin Joshi, Bharath Niwas",https://m.media-amazon.com/images/M/MV5BNTg4MzRmYWYtNjhkZC00Y2MxLThiZWUtYmFjYmVmMjdhMTA0XkEyXkFqcGc@._V1_.jpg,2,850
1096,tt1050739,Roadside Romeo,2008,"Animation, Adventure, Comedy","This is the story of Romeo. A dude who was living the life. He had the works - the mansion to live in, the chicks to party with and the cars to be driven around in. Until one day, the ...                See full summary »",Jugal Hansraj,"Saif Ali Khan, Kareena Kapoor, Jaaved Jaaferi, Vrajesh Hirjee",https://m.media-amazon.com/images/M/MV5BZTgyY2Q1NGYtZjRlOS00MWUwLTkxNmUtNGMwMWE4N2ZhNmRlXkEyXkFqcGc@._V1_.jpg,4.8,1727
1097,tt13878694,Maarrich,2022,"Crime, Mystery, Thriller",A police official starts a wild goose chase to find a murderer. The journey unfolds deep dark secrets from the past which leads to a spine chilling face off in the finale,Dhruv Lather,"Tusshar Kapoor, Chelsha Gosai, Aakash Dahiya, Rahul Dev",https://m.media-amazon.com/images/M/MV5BNjk5MjM2ZTctZTk3NS00ZWUxLTkxMDUtNTUyYWJjZTVhOWNmXkEyXkFqcGc@._V1_.jpg,6.3,5242
1098,tt28089784,Punjab '95,,"Biography, Crime, Drama",Based on the life of prominent human rights activist jaswant singh kalra.,Honey Trehan,"Arjun Rampal, Suvinder Vicky, Diljit Dosanjh, Varun Badola",https://m.media-amazon.com/images/M/MV5BNzA3MzE1MmEtNzE2Ni00MTMxLThlOGUtZjhlMzFiMTFlOTMzXkEyXkFqcGc@._V1_.jpg,,
1099,tt0449228,Dosti: Friends Forever,2005,"Drama, Romance","Karan Thapar, a wealthy young man, is saved by Raj Malhotra, a poor guy, from a near-death accident, which gives rise to their unending tale of friendship and brotherhood.",Suneel Darshan,"Akshay Kumar, Bobby Deol, Kareena Kapoor, Lara Dutta",https://m.media-amazon.com/images/M/MV5BZGYxMjIyMzctYzUyOS00MDAwLThjMzUtMjNjODM3ZmNjMjY1XkEyXkFqcGc@._V1_.jpg,5.3,2795
1100,tt0120551,Ziddi,1997,"Action, Drama","It is the story of a hot-tempered and stubborn man Deva, who is feared because of his ruthless ways and severe punishment to the local hoodlums. Later, Deva avenges the death of his brother and sister.",Guddu Dhanoa,"Sunny Deol, Raveena Tandon, Anupam Kher, Ashish Vidyarthi",https://m.media-amazon.com/images/M/MV5BNTA2OGM4MGUtYmE0NS00NmVjLWIzYTgtNjlmZGIwNjkxMGFmXkEyXkFqcGc@._V1_.jpg,5.9,1909
1101,tt0138411,Dushmun,1971,Drama,"A truck-driver accused of killing a man is sentenced to providing for the family of his victim. His interactions with the victim's village, as well as that person's widow and orphan, is the story.",Dulal Guha,"Meena Kumari, Mumtaz Askari, Rajesh Khanna, Kumari Naaz",https://m.media-amazon.com/images/M/MV5BMmE4MTQ3ZWMtMGNiOC00MTAyLTliOGMtNjBhZDJhYjFhMGJjXkEyXkFqcGc@._V1_.jpg,7.4,279
1102,tt6986710,The Accidental Prime Minister,2019,"Biography, Drama",Explores Manmohan Singh's tenure as the Prime Minister of India and the kind of control he had over the cabinet and the country.,Vijay Ratnakar Gutte,"Anupam Kher, Akshaye Khanna, Suzanne Bernert, Vipin Sharma",https://m.media-amazon.com/images/M/MV5BNDVhYjE1YWEtMWRjNy00Yjk4LWE0NjQtMWE5ZTU4MTkzNzk3XkEyXkFqcGc@._V1_.jpg,6,8359
1103,tt0395715,Preetam,1971,"Comedy, Romance","Rukmani gets married to Rana and faces endless abuse and beatings which do not end even when she gets pregnant. The Police arrest Rana for Robbery, try him in Court and sentence him to ...                See full summary »",Bhappi Sonie,"Shammi Kapoor, Leena Chandavarkar, Helen, Vinod Khanna",https://m.media-amazon.com/images/M/MV5BNWZhZDU4NjQtYTE2Ny00ZTVhLTk0Y2YtNjk5OGI4ODhkMTQ5XkEyXkFqcGc@._V1_.jpg,6.1,36
1104,tt6593054,Drive,2019,"Action, Crime, Thriller","A notorious thief allies with a street racer for a grand heist involving an elaborate game of deceit with authorities, who have their own dirty secrets.",Tarun Mansukhani,"Sushant Singh Rajput, Jacqueline Fernandez, Vikramjeet Virk, Sapna Pabbi",https://m.media-amazon.com/images/M/MV5BNGY5YjYxY2UtYzIxYS00ZjI3LWI0NWUtMDgxZjA5ZjBkZTE1XkEyXkFqcGdeQXVyODE5NzE3OTE@._V1_.jpg,3.2,8219
1105,tt27862531,Ajmer 92,2023,"Crime, Drama, History",The true events of the gang rape and blackmailing of over one hundred school and college-age girls in Ajmer.,Pushpendra Singh,"Karan Verma, Sumit Singh, Rajesh Sharma, Ishan Mishra",https://m.media-amazon.com/images/M/MV5BOTAzNDdkYjktNjBlYy00NzlhLTgwZDAtYWM3ZjYwMmYxOGZmXkEyXkFqcGc@._V1_.jpg,7.8,1334
1106,tt15502162,Hindutva,2022,Drama,"The depths of Hinduism is seen through its principal characters.Friendship, love and student politics are put in place.",Karan Razdan,"Agast Anand, Shiven Basnet, Surmeet Basra, Sonarika Bhadoria",https://m.media-amazon.com/images/M/MV5BZWI5YjQzNzAtYjllMC00YzhiLThmZWQtYTEzYjYzYjNjMDY2XkEyXkFqcGc@._V1_.jpg,4.8,3528
1107,tt10964468,Shakuntala Devi,2020,"Biography, Drama","Shakuntala Devi, a mathematician's journey to become 'The Human Computer' and her relationship with her daughter.",Anu Menon,"Vidya Balan, Adi Chugh, Sanya Malhotra, Jisshu Sengupta",https://m.media-amazon.com/images/M/MV5BYjQ0NGNmOGEtYTVjMS00MTYyLWFlODctODZiNDE4ZDMwYzJmXkEyXkFqcGdeQXVyODE5NzE3OTE@._V1_.jpg,6.1,9735
1108,tt0953306,Anwar,2007,"Drama, Romance, Thriller","Anwar, a middle-class Muslim, falls in love with Mehru, a Hindu girl. Post her death, he is caught by the police and a misunderstanding leads them to believe that he is a terrorist.",Manish Jha,"Siddharth Koirala, Nauheed Cyrusi, Manisha Koirala, Rajpal Naurang Yadav",https://m.media-amazon.com/images/M/MV5BNTNhN2RiNjgtNzAzOS00YTY5LWE3NWEtMTdhNWZkZWY1YWFkXkEyXkFqcGc@._V1_.jpg,6.5,1149
1109,tt0415003,Garv: Pride and Honour,2004,"Action, Crime, Drama",An honest and decorated police officer is arrested on charges of mass murder and trapped in a corrupt political system which sends him sinking into deeper and deeper trouble.,Puneet Issar,"Salman Khan, Shilpa Shetty Kundra, Arbaaz Khan, Akanksha Malhotra",https://m.media-amazon.com/images/M/MV5BYjhlNmNmZTQtZTZmZS00OTdkLTlmMzItY2EzODdkNWE2NTVjXkEyXkFqcGc@._V1_.jpg,5.6,5172
1110,tt7782402,The Storyteller,2022,Drama,"Based on Satyajit Ray's short story ""Golpo Boliye Tarini Khuro"" about originality versus plagiarism.",Anant Mahadevan,"Paresh Rawal, Adil Hussain, Revathi, Tannishtha Chatterjee",https://m.media-amazon.com/images/M/MV5BZjU2MTAxMmItYjI2YS00OWM0LWFlYjAtMWE1Nzk3MWRhOThmXkEyXkFqcGc@._V1_.jpg,6.9,710
1111,tt0418880,Mere Jeevan Saathi,2006,"Drama, Music, Romance","Back in college, Natasha was obsessed with Vicky, who has become a successful rock star. Nothing ever happened between them, however. At the time, Vicky was in love with Anjali, who one ...                See full summary »",Suneel Darshan,"Akshay Kumar, Karisma Kapoor, Ameesha Patel, Gulshan Grover",https://m.media-amazon.com/images/M/MV5BOTk2NTM3NDctMDdiMS00NTcyLTkyNDMtOWRiNTZkOGEyYmIxXkEyXkFqcGc@._V1_.jpg,3.4,1065
1112,tt2339505,Kochadaiiyaan,2014,"Animation, Action, Adventure","A noble warrior seeks revenge against the ruler of his kingdom, who killed his father, and also ends up upsetting the neighboring enemy kingdom's ruler.",Soundarya Rajinikanth Vishagan,"Rajinikanth, Deepika Padukone, R. Sarathkumar, Jackie Shroff",https://m.media-amazon.com/images/M/MV5BZTNkYzVlNzctMmVjYi00Zjk3LThiY2UtZTAwYmRiN2U4OWRhXkEyXkFqcGc@._V1_.jpg,6.2,5454
1113,tt0260411,Tahkhana,1986,"Action, Drama, Horror","A dying Thakur Surjeet Singh bequeaths the entire estate to his son, Raghuvir, disowning the other, Dhurjan, the family's black sheep, who also indulges in black magic. The latter swears to...                See full summary »","Shyam Ramsay, Tulsi Ramsay","Hemant Birje, Kamran Rizvi, Arti Gupta, Preeti Sapru",https://m.media-amazon.com/images/M/MV5BNzVmZDExN2YtMGM3NS00ZTRiLTkxMTEtMTgwN2UxNzczMjk4XkEyXkFqcGc@._V1_.jpg,5.6,276
1114,tt21357600,Bombay,2023,Action,"Ulas Mhatre, an underworld don operates activities with his trusted members Nana, Tatya, and Sherry. Things changes when Tatya goes missing with no evidence.",Sanjay Niranjan,"Gavie Chahal, Deepshikha Nagpal, Danish Bhatt, Ganesh Pai",https://m.media-amazon.com/images/M/MV5BYWY4N2U0NWUtYzhlNS00ZThkLTg3ZGQtNmI5ZTc1ZGE4MGYwXkEyXkFqcGc@._V1_.jpg,,
1115,tt0107321,King Uncle,1993,"Comedy, Drama, Family","When a runaway orphan ends up at the house of a cruel millionaire, she decides to alter his perception of the world.",Rakesh Roshan,"Jackie Shroff, Shah Rukh Khan, Nagma, Sushmita Mukherjee",https://m.media-amazon.com/images/M/MV5BNWQ4NzQwYTEtYzU3NC00OWY3LTg5YzktY2RiOTMwZjY3OTAyXkEyXkFqcGc@._V1_.jpg,5.3,3224
1116,tt1169270,Don,2007,"Action, Crime, Drama",A poor man becomes a benevolent gangster but faces threat from an even bigger gangster.,Raghava Lawrence,"Nagarjuna Akkineni, Anushka Shetty, Raghava Lawrence, Nikhita",https://m.media-amazon.com/images/M/MV5BOThlMjEyYWMtMmM5NS00ZjEyLTg1YTYtNzIxZTA3NTU5NzNhXkEyXkFqcGc@._V1_.jpg,5.8,1628
1117,tt16235600,Chhota Bheem aur Krishna: Mayanagari,2011,"Animation, Action, Fantasy","After Krishna stops Maayandri from releasing her brother, Kirmada, Maayandri decides to exact revenge on him. Later, Bheem and his friends set out to rescue Krishna and defeat Maayandri.",Rajiv Chilaka,Vatsal Dubey,https://m.media-amazon.com/images/M/MV5BMGJlNDAyZmMtM2IwYi00ZGY0LTgyMWQtYzFmNzZmNjUyZjgzXkEyXkFqcGc@._V1_.jpg,7.4,303
1118,tt18377806,Bedhadak,, ,"Romantic triangular LoveStory of 3 characters Karan, Angad and Nimrit,, which gives amazing drama and emotions..!.",Shashank Khaitan,"Lakshya, Vikram Bhatt, Shanaya Kapoor, Gurfateh Pirzada",https://m.media-amazon.com/images/M/MV5BMGNlY2ZkMjMtOTk0NS00Mjg3LTgzZGUtZWU1ZGQyMzUyODIxXkEyXkFqcGc@._V1_.jpg,,
1119,tt3698454,Yaara,2020,"Action, Crime, Drama",Former criminals reunite after years to rescue a friend arrested by the police.,"Manish Soni, Tigmanshu Dhulia","Vidyut Jammwal, Amit Sadh, Mohommed Ali Shah, Kenny Basumatary",https://m.media-amazon.com/images/M/MV5BZTQxODM2MWUtZTVkYi00YWQ5LTlkODItNTc1YWQ2YmRjNmNiXkEyXkFqcGc@._V1_.jpg,5.9,6691
1120,tt8647400,De De Pyaar De,2019,"Comedy, Drama, Romance",A 50-year-old single father faces disapproval from his family and his ex-wife when he falls in love with a 26-year-old woman.,Akiv Ali,"Ajay Devgn, Tabu, Rakul Preet Singh, Jimmy Shergill",https://m.media-amazon.com/images/M/MV5BNmU4ZDNmOGQtNzUxMC00MmJkLWE5MDYtZTA4NTNiOTk3OTAwXkEyXkFqcGc@._V1_.jpg,6.5,9363
1121,tt10305616,Malaal,2019,"Action, Drama, Romance","Malaal is the story of Shiva and Astha, two very different people from contrasting backgrounds who experience the innocence of love. Does their love find its destination or do they part ways? Stay on this journey to find out.",Mangesh Hadawale,"Meezaan Jafri, Sharmin Segal, Chinmayee Surve, Anil Gawas",https://m.media-amazon.com/images/M/MV5BMGMxNTA4YjItNTc0NS00N2MwLThkNjktNjFmMTRjNmM4OTM0XkEyXkFqcGc@._V1_.jpg,5.9,1473
1122,tt8705332,Match Of Life,2022,Comedy,"Match of Life"" is based on a cricketer's life who looks like Virat Kohli and what circumstances he faces in day-to-day life being a normal person with a celebrity face.",Aman Sagar,"Rajpal Naurang Yadav, Sudha Chandran, Pankaj Berry, Supriya Karnik",https://m.media-amazon.com/images/M/MV5BNmNkNTBlMzEtNDExNS00Zjk2LTk4YTMtNmI2YTIyNGM5ZmMwXkEyXkFqcGc@._V1_.jpg,7.6,68
1123,tt7647774,Ek Betuke Aadmi Ki Afrah Raatein,2023,Drama,Add a Plot,Sharad Raj,"Pawan Chakravarti, Archanna Guptaa, Adil Hussain, Raghav Jhingran",https://m.media-amazon.com/images/M/MV5BYWVmOWFiMmEtZDVmNi00NjEzLTkxOWEtY2M0ZGI5NDVmM2RiXkEyXkFqcGc@._V1_.jpg,6.2,8
1124,tt1714832,Do Dooni Chaar,2010,"Comedy, Crime, Drama",A middle class family in India tries to buy a new car.,Habib Faisal,"Rishi Kapoor, Neetu Singh, Aditi Vasudev, Archit Krishna",https://m.media-amazon.com/images/M/MV5BZmYyM2I5ZjktMjJiMC00NWQzLWFlNDAtYzA0ZWQwMzE0OTJhXkEyXkFqcGc@._V1_.jpg,7.5,6094
1125,tt0172175,Bhabhi,1991,"Comedy, Drama, Family","Sita lives a middle-class lifestyle with her retired and widowed schoolmaster dad, Ramdas. One day she is molested by Prakash and slaps him. A few days later, wealthy Ghanshyamdas, a former...                See full summary »",Kishore Vyas,"Bhanupriya, Govinda, Juhi Chawla, Gulshan Grover",https://m.media-amazon.com/images/M/MV5BYjZiYTU2MzgtYmY2Ny00YjRiLWEwMGEtMzUxOWYyNzdiMWUyXkEyXkFqcGc@._V1_.jpg,4.3,163
1126,tt0247944,Badal,2000,"Action, Crime, Drama","Badal (Bobby Deol) is a victim of the 1984 riots, brought up by a terrorist (Ashish Vidyarthi). Badal lives with the sole aim of exterminating a police cop Rana (Ashutosh Rana) now the DGP....                See full summary »",Raj Kanwar,"Bobby Deol, Rani Mukerji, Mayuri Kango, Ashutosh Rana",https://m.media-amazon.com/images/M/MV5BNmNmZTBlODYtOTExMS00OGIwLTg0OTktYjEzZGRkMDhmM2E3XkEyXkFqcGc@._V1_.jpg,5,1599
1127,tt3807778,Badla Sherni Ka,2001,Action,"Jungle woman Sherni objects when greedy hunters invade the forest, killing the animals for their tusks and hides.",Kanti Shah,"Sapna Sappu, Amit Pachori, Junior Johnny Lever, Anil Nagrath",https://m.media-amazon.com/images/M/MV5BZDFkZjMxZGQtNTkzNS00NmQ1LWE2ZWItZDhiNGY1NjEyOWJhXkEyXkFqcGc@._V1_.jpg,7.9,42
1128,tt27613132,Awara Pagal Deewana 2,, ,"After faking his death, former killer-for-hire Guru Gulab Khatri retires to Maldives with his new wife, Tina, while his ex-wife, Preeti, settles down in California with Anmol. The peaceful lives of both couples are interrupted by a mafia.",Ahmed Khan,"Akshay Kumar, Sanjay Dutt, Disha Patani, Dalip Singh",https://m.media-amazon.com/images/M/MV5BNzJlYmEyOGItYWQzOS00MmMzLTkzOTItOTc1NDI0NDY5YzRhXkEyXkFqcGc@._V1_.jpg,,
1129,tt10318332,Badnaam Gali,2019,Comedy,"It encompasses the journey of a surrogate mother, played by Patralekhaa, and her dynamic relationship with people around her.",Ashwin Shetty,"Patralekhaa Paul, Divyendu Sharma, Dolly Ahluwalia, Paritosh Sand",https://m.media-amazon.com/images/M/MV5BNzY0ZGE1YTItNWE1Mi00MzYxLWI0MzctNmU4Y2E5ZGMwNWQ2XkEyXkFqcGc@._V1_.jpg,6.9,1429
1130,tt2199711,Vishwaroopam,2013,"Action, Thriller","When a classical dancer's suspecting wife sets an investigator behind him, a series of violent events are triggered, revealing his real identity and connection to a darker world.",Kamal Haasan,"Pooja Kumar, Miles Anderson, Kamal Haasan, Rahul Bose",https://m.media-amazon.com/images/M/MV5BZjAzNDBlNTMtMWFhMC00NGM4LWFhNzAtNTYwNWNjOTIzODUwXkEyXkFqcGc@._V1_.jpg,7.9,41294
1131,tt13491620,Unpaused,2020,"Drama, Romance","An anthology that brings together 5 unique creators of Hindi cinema featuring stories of love, new beginnings, second chances, and a glimmer of hope. Set and filmed in the times of the Covid-19 lockdown.","Nikkhil Advani, Avinash Arun, Tannishtha Chatterjee, Krishna D.K., Nitya Mehra, Raj Nidimoru","Gulshan Devaiah, Saiyami Kher, Richa Chadha, Ishwak Singh",https://m.media-amazon.com/images/M/MV5BODc2M2Y1YjgtY2VjNi00MTdhLWIzMzItZGU0ZDczMGYxN2YyXkEyXkFqcGc@._V1_.jpg,7,2716
1132,tt23220368,Vedaat Maratha Veer Daudale Saat,,History,Seven valiant warriors who had the sole aim of bringing Shivaji Maharaj's dream of Swarajya to reality.,Mahesh Manjrekar,"Akshay Kumar, Pravin Tarde, Satya Manjrekar, Utkarsh Shinde",https://m.media-amazon.com/images/M/MV5BZDg3OTlkZjEtMDRhZi00MmE4LWFmZWQtODRiOTM4N2Q2Y2RiXkEyXkFqcGc@._V1_.jpg,,
1133,tt18265146,Victoria: Ek Rahasya,2023,"Horror, Thriller",A couple arrives at Hotel Victoria and are greeted by the creepy owner who is the only occupant of the sprawling property. The hotel seems to house a sinister presence that harasses the couple till the secrets of the hotel are unearthed.,"Jeet Ashok, Virajas Kulkarni","Pushkar Jog, Sonalee Kulkarni, Aashay Kulkarni, Heera Sohal",https://m.media-amazon.com/images/M/MV5BMTk0MjJlZDItMjhkMi00Nzk2LWE4N2YtMjBmN2RjMzJmN2EyXkEyXkFqcGc@._V1_.jpg,4.3,175
1134,tt0173369,Tum Mere Ho,1990,"Fantasy, Horror, Romance",Shiva is blessed with magical powers of charming snakes. He falls head-over-heels in love with Paro.,Tahir Hussain,"Aamir Khan, Juhi Chawla, Ajit Vachani, Sudhir Pandey",https://m.media-amazon.com/images/M/MV5BM2E5ZTEzMjktYzUwZi00ZGRmLThmYzUtMTlmODExOGVkZTQ5XkEyXkFqcGc@._V1_.jpg,3.9,1011
1135,tt0326983,Jaani Dushman: Ek Anokhi Kahani,2002,"Action, Fantasy, Horror",A shape-shifting snake exacts vengeance on a group of friends for a crime they did not even commit.,Rajkumar Kohli,"Sunny Deol, Arman Kohli, Manisha Koirala, Akshay Kumar",https://m.media-amazon.com/images/M/MV5BZjc5MTljZmEtODE1Mi00MDdhLTk0MjMtODkyYmU0NzM5YWJlXkEyXkFqcGc@._V1_.jpg,2.7,3983
1136,tt0075669,Amar Akbar Anthony,1977,"Action, Comedy, Drama","Three brothers are separated and united after many years - one is brought up a Hindu, another a Muslim and the last (and most memorable) a Christian. Hilarity and adventure ensues.",Manmohan Desai,"Vinod Khanna, Rishi Kapoor, Amitabh Bachchan, Shabana Azmi",https://m.media-amazon.com/images/M/MV5BNTMzNzE1YTUtYTMyOS00YWNhLWJlZWUtNDMwZjQ0MzQ3MWYwXkEyXkFqcGdeQXVyODE5NzE3OTE@._V1_.jpg,7.4,8310
1137,tt15547882,Spirit,X, ,A gang leader tries to keep a promise made to his dying friend and takes on the other criminal gangs.,Sandeep Reddy Vanga,"Shahid Kapoor, Prabhas, Olivia Morris, Trisha Krishnan",https://m.media-amazon.com/images/M/MV5BOGJkMTYzYzctODkxMi00MjljLWI5MDMtNDg3MTZiZWY1NTU1XkEyXkFqcGc@._V1_.jpg,,
1138,tt0116763,Khamoshi: The Musical,1996,"Drama, Musical, Romance",The daughter of deaf-mute parents seeks their understanding when she discovers a love for music.,Sanjay Leela Bhansali,"Manisha Koirala, Nana Patekar, Salman Khan, Seema Biswas",https://m.media-amazon.com/images/M/MV5BYTlhNzY1NDEtMzY1My00NTgzLWFmMmUtZjcxODlhMjExMGM2XkEyXkFqcGc@._V1_.jpg,7.4,4800
1139,tt0061072,Teesri Kasam,1966,"Comedy, Drama, Romance",A naive bullock-cart driver falls for a traveling courtesan.,Basu Bhattacharya,"Raj Kapoor, Waheeda Rehman, Dulari, Iftekhar",https://m.media-amazon.com/images/M/MV5BYWY0MTJkYTUtYTFhOS00NmRjLWI3ZGItNjQ2ZGQwZDljYjEwXkEyXkFqcGc@._V1_.jpg,7.9,869
1140,tt9680136,Pati Patni Aur Woh,2019,"Comedy, Romance","Chintu Tyagi is an ordinary, middle class man who finds himself torn between his wife and another woman.",Mudassar Aziz,"Kartik Aaryan, Bhumi Pednekar, Ananya Panday, Aparshakti Khurana",https://m.media-amazon.com/images/M/MV5BZjk3ZDhhNWItOGUxYi00NTY1LWIxN2ItNzRiNWZhNTZiYTcyXkEyXkFqcGc@._V1_.jpg,5.8,8726
1141,tt15516226,Chhatriwali,2023,"Comedy, Drama","Sanya is an unemployed chemistry genius looking for a job. However, she also wants to use her knowledge of chemistry to help young minds move beyond the taboos of sex with the right education.",Tejas Prabha Vijay Deoskar,"Rakul Preet Singh, Sumeet Vyas, Satish Kaushik, Dolly Ahluwalia",https://m.media-amazon.com/images/M/MV5BYzJiNjljYTktNzcyNC00ZTQxLWE5OWQtZTU0YjczNTA4MDQ0XkEyXkFqcGc@._V1_.jpg,6.6,11186
1142,tt10515526,Lootcase,2020,"Comedy, Crime","Nandan Kumar comes across a suitcase and discovers it is full of cash. He takes the suitcase and soon finds himself being chased by a notorious gangster, an honest cop and a minister, who want the suitcase at any cost.",Rajesh Krishnan,"Kunal Kemmu, Rasika Dugal, Vijay Raaz, Ranvir Shorey",https://m.media-amazon.com/images/M/MV5BNmVkM2U1YzgtODg3Ni00ZTEzLTkxZDItZWZlYmUxOGY1MDk5XkEyXkFqcGc@._V1_.jpg,7.5,18513
1143,tt0047990,Devdas,1955,"Drama, Musical, Romance",The scion of a wealthy landowner family turns to alcohol and self-pity and slowly self-destructs after class differences force him to break off his relationship with his childhood sweetheart.,Bimal Roy,"Dilip Kumar, Suchitra Sen, Vyjayanthimala, Motilal",https://m.media-amazon.com/images/M/MV5BOWE5YWIyNWEtYzBlOC00MDBlLTgzMjgtYzk1OTJiNjEzM2Y2XkEyXkFqcGc@._V1_.jpg,7.7,2075
1144,tt27028399,Murder Mubarak,,"Comedy, Horror, Mystery",Add a Plot,Homi Adajania,"Vijay Varma, Sara Ali Khan, Pankaj Tripathi, Dimple Kapadia",https://m.media-amazon.com/images/M/MV5BNTNiZDUwYmYtNTY5ZC00ZTRlLWJhODAtOThmMjM2MTUwNWVhXkEyXkFqcGdeQXVyMTUzNTgzNzM0._V1_.jpg,5.9,49487
1145,tt28539592,Rambo,,Action,Add a Plot,Rohit Dhawan,"Tiger Shroff, Janhvi Kapoor",https://m.media-amazon.com/images/M/MV5BNjZhMDc2OTItNjZkMi00NjVkLTljZDYtMjNhODVkZjFhYTVlXkEyXkFqcGc@._V1_.jpg,,
1146,tt23865942,Sarzameen,,"Drama, Mystery, Thriller","A family, in the middle of a rising insurgency in Kashmir, and a terrible secret linking the two..",Kayoze Irani,"Kajol, Prithviraj Sukumaran, Tota Roy Chowdhury, Rajesh Sharma",Not Available,,
1147,tt24245466,Ruslaan,,"Action, Thriller",Plot under wraps.,Katyayan Shivpuri,"Jagapathi Babu, Aayush Sharma, Vidya Malvade, Richard Bhakti Klein",https://m.media-amazon.com/images/M/MV5BZjllMzZjOGYtOTNmNy00YzU4LThmNjItNThjN2RmNWIyODI1XkEyXkFqcGc@._V1_.jpg,3.3,1237
1148,tt0150433,Earth,1998,"Drama, Romance, War",It's 1947 and the borderlines between India and Pakistan are being drawn. A young girl witnesses tragedy as her ayah (nanny) is caught between the love of two men and the rising tide of political and religious violence.,Deepa Mehta,"Aamir Khan, Nandita Das, Rahul Khanna, Maia Sethna",Not Available,7.6,8184
