Serial No,movie_id,movie_name,year,genre,overview,director,cast,poster_url,rating,votes
1660,tt0420304,Viruddh... Family Comes First,2005,"Drama, Family",An ordinary 60 plus couple - Vidhyadhar Patwardhan and his wife are forced to search for their faith in human values and society after the death of their only son Amar. In the process they undergo the most testing struggle of their lives.,Mahesh Manjrekar,"Amitabh Bachchan, Sharmila Tagore, John Abraham, Sanjay Dutt",https://m.media-amazon.com/images/M/MV5BOTEyNDJmM2QtZTEwOC00ODA4LTlhMjAtZWVhNzUyYzVlZjAzXkEyXkFqcGc@._V1_.jpg,7,2255
1661,tt0444913,Tango Charlie,2005,"Action, Adventure, Drama","Tarun Chauhan, a rookie army officer undergoes ups and downs in his mission and learns the true meaning of 'war' to overcome his weaknesses.",Mani Shankar,"Ajay Devgn, Bobby Deol, Sanjay Dutt, Suniel Shetty",https://m.media-amazon.com/images/M/MV5BZGE5MDUwZDgtMzcxOS00ODZkLTk5NTQtMDY2MTY5ZTAzZmEzXkEyXkFqcGc@._V1_.jpg,6.1,2382
1662,tt3611266,Bank Chor,2017,"Action, Comedy, Crime","A comic-caper, that tells the story of 3 morons trying to rob a bank who pick the worst day possible when everything that can go wrong, goes wrong and how they're inadvertently caught in the crossfire.",Bumpy,"Riteish Deshmukh, Vivek Oberoi, Rhea Chakraborty, Sahil Vaid",https://m.media-amazon.com/images/M/MV5BMTUzODAzNTM4Ml5BMl5BanBnXkFtZTgwMjQ1NTYyNTM@._V1_.jpg,6,3264
1663,tt2341766,Nautanki Saala!,2013,"Comedy, Drama, Romance","Ram, a successful theatre artist, saves Mandar from committing suicide. He then ends up developing a special bond with Mandar and even helps solve his problems.",Rohan Sippy,"Ayushmann Khurrana, Kunaal Roy Kapur, Pooja Salvi, Gaelyn Mendonca",https://m.media-amazon.com/images/M/MV5BNTA1ZDA2ODAtMmI3Ny00ZmYxLWE3ZDktMTgwYzc0ZTY4MzYwXkEyXkFqcGc@._V1_.jpg,5.8,4512
1664,tt2186933,Luv Shuv Tey Chicken Khurana,2012,Comedy,A fugitive frantically looks for a much-coveted chicken curry recipe with which his family can reclaim their pride and wealth.,Sameer Sharma,"Kunal Kapoor, Huma Qureshi, Vinod Nagpal, Rajesh Sharma",https://m.media-amazon.com/images/M/MV5BMTY2OTk3MTg2MV5BMl5BanBnXkFtZTcwNDY5MzY1OA@@._V1_.jpg,6.6,4135
1665,tt0215911,Koshish,1972,Drama,A speech and hearing-impaired couple persists through unforgiving obstacles to be accepted by society and live a life of dignity.,Gulzar,"Sanjeev Kumar, Jaya Bachchan, Govardhan Asrani, Seema Deo",https://m.media-amazon.com/images/M/MV5BYmEyNDFjNjYtMDRiNS00Y2M4LThjNDItZWIxY2MzMDRiNTEwXkEyXkFqcGc@._V1_.jpg,8.4,1818
1666,tt1736647,Sakthi,2011,"Action, Adventure, Fantasy","While on a trip, a guide starts protecting the central minister's daughter from some Egyptians who want her and a holy diamond in their custody.",Meher Ramesh,"N.T. Rama Rao Jr., Ileana D'Cruz, Pooja Bedi, Sonu Sood",https://m.media-amazon.com/images/M/MV5BYTNhNTU5YWUtZGJkNy00NGQ4LTk1ZGQtNGYxNjdmNmEwMWExXkEyXkFqcGc@._V1_.jpg,3.5,1515
1667,tt0368811,Jajantaram Mamantaram,2003,"Action, Adventure, Comedy","A young man lands in the land of little people, who ask him to save them from their enemies.",Soumitra Ranade,"Jaaved Jaaferi, Gulshan Grover, Manav Kaul, Joy Fernandes",https://m.media-amazon.com/images/M/MV5BMTlmN2UwOGUtZWM2Mi00NTJjLWE4YTAtMTNiNzJhMjU2MzVlXkEyXkFqcGc@._V1_.jpg,6,1732
1668,tt2094854,Inkaar,2013,"Drama, Romance, Thriller","At a leading ad agency, the battle for the top job between Rahul Verma, the advertising CEO, and Maya Luthra, his ambitious protégée, takes an ugly turn when Maya files a sexual harassment complaint against Rahul.","Sudhir Mishra, Jay Dev Banerjee","Arjun Rampal, Chitrangda Singh, Vipin Sharma, Mithun Rodwittiya",https://m.media-amazon.com/images/M/MV5BODAxMzRiNTMtYTU4Ni00MTkxLWI4ZDMtOTM0ZmQ1OTU4NzVjXkEyXkFqcGdeQXVyODE5NzE3OTE@._V1_.jpg,6.1,2709
1669,tt0115042,Zamaana Deewana,1995,"Action, Comedy, Drama",A police commissioner enlists the aid of an eccentric inspector to end a gang war between bitter enemies.,Ramesh Sippy,"Jeetendra, Shatrughan Sinha, Shah Rukh Khan, Raveena Tandon",https://m.media-amazon.com/images/M/MV5BMTAxOTcwNzgzNzheQTJeQWpwZ15BbWU3MDMzNzg4MzE@._V1_.jpg,4.7,2249
1670,tt0203289,American Desi,2001,"Comedy, Drama, Romance","College freshman Krishna Reddy, who has never cared for his Indian-American cultural heritage, looks forward to a new life on campus but is surprised to find that he has been assigned ...                See full summary »",Piyush Dinker Pandya,"Deep Katdare, Ronobir Lahiri, Purva Bedi, Rizwan Manji",https://m.media-amazon.com/images/M/MV5BMTc2OTg4MTQ5Ml5BMl5BanBnXkFtZTcwODQ4ODQyMQ@@._V1_.jpg,6.6,1676
1671,tt9817760,Jai Mummy Di,2020,"Comedy, Drama, Romance",Jai Mummy Di is a light-hearted family comedy that portrays the trials and tribulations a couple has to undergo due to the dynamics between their respective mothers.,Navjot Gulati,"Poonam Dhillon, Supriya Pathak, Sunny Singh, Sonnalli Seygall",https://m.media-amazon.com/images/M/MV5BNjEyMjM0ZTYtNzY5Yy00YjE2LWFhZDUtYWY3YTVjOWE0MTAzXkEyXkFqcGdeQXVyODE5NzE3OTE@._V1_.jpg,3.7,1072
1672,tt12631534,Rosie: The Saffron Chapter,2022,"Horror, Mystery, Thriller",A film based on true events in Gurugram.,Vishal Mishra,"Arbaaz Khan, Tanishaa Mukerji, Shivin Narang, Vivek Oberoi",https://m.media-amazon.com/images/M/MV5BNzY0NTRmMjUtNTU0YS00OTdjLTllNzAtMzY1YThhNWM1MWRiXkEyXkFqcGc@._V1_.jpg,,
1673,tt27510174,Stree 2,2024,"Comedy, Horror",Add a Plot,Amar Kaushik,"Shraddha Kapoor, Rajkummar Rao, Pankaj Tripathi, Varun Dhawan",https://m.media-amazon.com/images/M/MV5BMTA1NmUxYzItZmVmNy00YmQxLTk4Y2UtZjVkMWUwMWQ5N2IxXkEyXkFqcGc@._V1_.jpg,7.1,34041
1674,tt0214178,Sooryavansham,1999,"Action, Drama","Heera fails to live up to expectations of his father Thakur Bhanupratap Singh, a powerful and respected man of his community. Despite all odds Heera struggles to keep his father's pride.","E.V.V. Satyanarayana, Pranavanand","Amitabh Bachchan, Soundarya, Jayasudha, Mukesh Rishi",https://m.media-amazon.com/images/M/MV5BMTQ5Mjk5MzA4M15BMl5BanBnXkFtZTcwODQzODcyMQ@@._V1_.jpg,6.3,3956
1675,tt8130558,One Day: Justice Delivered,2019,"Action, Crime, Thriller",A Crime Branch Special Officer Investigates the Serial disappearance of high profile individuals in a state capital.,Ashok Nanda,"Anupam Kher, Kumud Mishra, Esha Gupta, Zakir Hussain",https://m.media-amazon.com/images/M/MV5BOTM2MWQ5YTctYjE2MS00NTBiLWFiMzYtOWY4ZWE1MGQxN2E5XkEyXkFqcGc@._V1_.jpg,5.1,2758
1676,tt0248216,Na Tum Jaano Na Hum,2002,"Comedy, Drama, Musical",A romantically inclined couple decide to get to know each other through letters without disclosing their identities.,Arjun Sablok,"Hrithik Roshan, Saif Ali Khan, Esha Deol, Alok Nath",https://m.media-amazon.com/images/M/MV5BYTU0NTcyZmMtNjI0MC00ZDJhLWJlYzAtMDdhNjY1Yjg2YmRhXkEyXkFqcGc@._V1_.jpg,4.9,3117
1677,tt4949324,Mohalla Assi,2015,"Comedy, Drama",A Sanskrit priest decides to take matters in n his hand when the locals of holy town Banaras stars to lure foreign tourists with fake spiritual gurus.,Chandra Prakash Dwivedi,"Sunny Deol, Sakshi Tanwar, Ravi Kishan, Saurabh Shukla",https://m.media-amazon.com/images/M/MV5BNTY5M2NkM2MtMjBmMi00NTY1LTg4YWItMDBmMzgzMThkOGNiXkEyXkFqcGc@._V1_.jpg,6.6,2008
1678,tt5207116,X: Past Is Present,2015,"Drama, Mystery, Romance",A filmmaker with a mid-life crisis meets a mysterious young girl who reminds of every woman in his past.,"Hemant Gaba, Pratim D. Gupta, Sudhish Kamath, Nalan Kumarasamy, Anu Menon, Sandeep Mohan, Qaushiq Mukherjee, Rajshree Ojha, Raja Sen, Abhinav Shiv Tiwari, Suparn Varma","Rajat Kapoor, Radhika Apte, Bidita Bag, Piaa Bajpai",https://m.media-amazon.com/images/M/MV5BMjIzNjM0OTk2NF5BMl5BanBnXkFtZTgwNTg2NTEzNzE@._V1_.jpg,5.2,756
1679,tt15260176,Despatch,2023,Drama,"News has turned digital, leaving veteran crime journalist Joy at the cusp of irrelevance. Determined to break the next big story and refashion his complicated personal life, Joy embarks on ...                See full summary »",Kanu Behl,"Manoj Bajpayee, Shahana Goswami, Nikhil Vijay, Ajay Purkar",https://m.media-amazon.com/images/M/MV5BM2M0MzAzOGUtZGZkOS00ZmI2LTkzYTEtNjMzMDc0ZDRlZTFmXkEyXkFqcGc@._V1_.jpg,4.4,4322
1680,tt1273218,Kuselan,2008,"Comedy, Drama, Family","Story related to old friends ,after one being a popular actor and other being a barber and managing family.",P. Vasu,"Rajinikanth, Pasupathy, Meena, Nayanthara",https://m.media-amazon.com/images/M/MV5BOGIzZTdmNGMtM2Y0My00ZmE5LTlhNGUtNWZkMzc5MTVjYjY3XkEyXkFqcGc@._V1_.jpg,4.9,1225
1681,tt0431873,Lagaam,1976,Action,"Bhima, a strong and brave youth, according to an oath given to his mother renounces violence. This makes him suffer humiliation and indignity at the hands of Sambha - a gang leader. Finding...                See full summary »",Desh Gautam,"Vinod Khanna, Yogeeta Bali, Bindu Desai, Prem Chopra",https://m.media-amazon.com/images/M/MV5BMzVjZGE2OTktZjkyMi00OTI2LWIzOTQtZmZkYjg2ZmRlOTE1XkEyXkFqcGc@._V1_.jpg,6.9,14
1682,tt0067840,Tere Mere Sapne,1971,"Drama, Romance","Dr. Anand Kumar attains his degree in medicine and re-locates to a small village to assist the local doctors there. Upon arrival, he is met by the ailing Dr. Prasad and his wife, and hired ...                See full summary »",Vijay Anand,"Dev Anand, Mumtaz Askari, Mahesh Kaul, Vijay Anand",https://m.media-amazon.com/images/M/MV5BNWEzNzAyMTYtMTY4My00ZjFkLTliMjUtMDlhOWY1MzQ4NzY2XkEyXkFqcGc@._V1_.jpg,7.6,291
1683,tt0437407,Parineeta,2005,"Drama, Musical, Romance",The lifelong romance between Lolita (Balan) and Shekar (Khan) is upset by the arrival of another man.,Pradeep Sarkar,"Vidya Balan, Saif Ali Khan, Sanjay Dutt, Dia Mirza",https://m.media-amazon.com/images/M/MV5BMTcwOTEyMTYyM15BMl5BanBnXkFtZTcwMTEyMTAzMQ@@._V1_.jpg,7.2,9748
1684,tt11069946,The Immortal Ashwatthama,,"Action, Adventure, Fantasy",Follows Ashwatthama's journey as he seeks redemption and immortality.,Aditya Dhar,"Allu Arjun, Vicky Kaushal, Sara Ali Khan",https://m.media-amazon.com/images/M/MV5BNmE2ZDJlYWEtNTExMS00YTk5LTk3NDQtMjAyZmE1MTZmZGU0XkEyXkFqcGc@._V1_.jpg,,
1685,tt1188982,Jai Ho,2014,"Action, Drama","An upright ex-army man, Jai fights a solitary war against corruption and injustice. With a simple mantra to pay forward, he starts off by helping one person and forms an ever growing circle of people helping each other.",Sohail Khan,"Salman Khan, Daisy Shah, Tabu, Danny Denzongpa",https://m.media-amazon.com/images/M/MV5BMWQ3ZGRjYjUtMDBkMi00MzY3LWFkYjItMmRhY2NjZWExY2ZhXkEyXkFqcGc@._V1_.jpg,5,20796
1686,tt2140465,Tanu Weds Manu Returns,2015,"Comedy, Drama, Romance",Tanu and Manu's marriage collapses. What happens when Manu meets Tanu's lookalike Kusum - and when Tanu returns?,Aanand L. Rai,"Kangana Ranaut, Madhavan, Jimmy Shergill, Deepak Dobriyal",https://m.media-amazon.com/images/M/MV5BMjMwMTExMjA1OV5BMl5BanBnXkFtZTgwNDI5MTcyNjE@._V1_.jpg,7.6,29721
1687,tt1694542,Tanu Weds Manu,2011,"Comedy, Drama, Romance","Manu comes to India to find a bride and falls for Tanu at first sight, but free-spirited Tanu has no plan to marry him.",Aanand L. Rai,"Madhavan, Kangana Ranaut, Jimmy Shergill, Deepak Dobriyal",https://m.media-amazon.com/images/M/MV5BZGU4ZGU3N2ItYmFkOS00NjdhLTlhMDgtODJjZTQwNmFiNWI4XkEyXkFqcGc@._V1_.jpg,6.8,16522
1688,tt14083776,Karma Strikes,2023,"Drama, Romance, Thriller",Every Love Story faces its Karma; so did theirs.,Kartik Swaminathan Venkatraman,"Johnny Serret, Yuvradnyee, Michael Stephen Walls, Sagar Sharma",https://m.media-amazon.com/images/M/MV5BNzg0ZDJjMmQtOGFkYy00Yzg3LWEwMzItM2FmYWMxYTgzZTk4XkEyXkFqcGc@._V1_.jpg,6.2,384
1689,tt0104645,Kshatriya,1993,"Action, Drama, War","In order to get rain for the arid region in Rajasthan, India, two royal families, from Mirtagarh and Surjangarh, have come together with their warriors, and fought with each other annually,...                See full summary »",J.P. Dutta,"Sunil Dutt, Dharmendra, Vinod Khanna, Rakhee Gulzar",https://m.media-amazon.com/images/M/MV5BMTU5ODY0ODkwNV5BMl5BanBnXkFtZTcwNzA5NzAyMg@@._V1_.jpg,5.9,743
1690,tt0094958,Dayavan,1988,"Action, Crime, Drama","The story of Dayavan, a benevolent gangster who dedicates his life to helping those less fortunate than himself.",Feroz Khan,"Vinod Khanna, Feroz Khan, Amala Akkineni, Amrish Puri",https://m.media-amazon.com/images/M/MV5BOGViMjA2YTUtNzkyMS00MzgwLWEzZGMtODc1MDE2MTRmZDBiXkEyXkFqcGc@._V1_.jpg,6.4,682
1691,tt29169633,Tamso,2023,"Drama, Horror, Thriller",Add a Plot,Stephen Alexander,"Rashmi Somvanshi, Ritika Gupta, Vaishnavi Singh, Ansh Pandey",https://m.media-amazon.com/images/M/MV5BNDdlYWE1NTktMDQxMi00Y2E5LWJjOTktOGY1ZWRlMmYxNGQ4XkEyXkFqcGc@._V1_.jpg,8.6,44
1692,tt0286672,Haqeeqat,1995,"Action, Drama, Romance","After her husband, Ravi Malhotra, is killed, Sudha lives the life of a widow with her brother, Mahesh, and Bhabhi, Kamini. A new tenant, Ajay, comes to her rescue when she is molested by ...                See full summary »",Kuku Kohli,"Ajay Devgn, Tabu, Aruna Irani, Mohan Joshi",https://m.media-amazon.com/images/M/MV5BMzBjYTMyMmUtMzgxNS00YWZkLTgyOWEtZWQ1OGIxMTkwMjhlXkEyXkFqcGc@._V1_.jpg,4.6,426
1693,tt0076167,Hum Kisise Kum Naheen,1977,"Action, Comedy, Drama",Rajesh belonged to a wealthy family his father turned all his savings from Africa into diamonds and hid it in a belt and was returning to India where he is followed by gang of smugglers he ...                See full summary »,Nasir Hussain,"Rishi Kapoor, Tariq, Kaajal Kiran, Amjad Khan",https://m.media-amazon.com/images/M/MV5BZmZhYmQwZmQtNWViMS00OWYyLWI1M2ItZTFlYzIyZmYxMGQwXkEyXkFqcGc@._V1_.jpg,7.1,577
1694,tt13556522,Apne 2,,Drama,Add a Plot,Anil Sharma,"Sunny Deol, Dharmendra, Bobby Deol, Rohit Choudhary",https://m.media-amazon.com/images/M/MV5BYjk5MWFjYjQtODIyZi00OWVlLWI1ZjYtNmJhNTNiNjhkMjg0XkEyXkFqcGc@._V1_.jpg,,
1695,tt0476819,Nehlle Pe Dehlla,2007,"Action, Comedy, Crime",Two crooks attempts to blackmail a rich hotelier in order to get a huge sum of money. The plan goes horribly wrong as the hotelier is murdered and they have no choice except keeping his body to show him alive in order to be safe from law.,Ajay Chandhok,"Sanjay Dutt, Bipasha Basu, Saif Ali Khan, Kim Sharma",https://m.media-amazon.com/images/M/MV5BNmUzNjcwZTktNmEzZC00Y2NiLTljZmYtNmEwZDRkYzZhNjk1XkEyXkFqcGc@._V1_.jpg,3.7,610
1696,tt0250122,Yeshwant,1997,"Action, Crime, Drama","Tough policier about a straight, but maverick cop who does not believe in bending over, no matter what. He encourages his wife to become a top government officer and tutors her at home, ...                See full summary »",Anil Mattoo,"Nana Patekar, Madhoo, Atul Agnihotri, Mohan Joshi",https://m.media-amazon.com/images/M/MV5BMTMyNjI5MTkyMl5BMl5BanBnXkFtZTcwNDIyNDE0MQ@@._V1_.jpg,7.2,1286
1697,tt12845296,The Hidden Strike,2020,War,The Hidden Strike is a fictional movie about a ground mission where a team of thirteen Indian Army officers and soldiers went across POK and destroyed the terrorist camp with a planned sub ...                See full summary »,Suzad Iqbal Khan,"Deepraj Rana, Mir Sarwar, Jimmy Sharma, Lakhwinder",https://m.media-amazon.com/images/M/MV5BMDdmY2E4ZGEtZjZhOS00Y2IyLTljYTEtYWNiODFmM2YzZWRmXkEyXkFqcGc@._V1_.jpg,4.3,65
1698,tt14103312,Woh Ladki Hai Kahaan,2023,"Comedy, Drama",An investigative comedy where a lady cop and a groom starts looking for the bride.,Arshad Syed,"Taapsee Pannu, Pratik Gandhi, Prateik Patil Babbar, Mahadev Singh Lakhawat",https://m.media-amazon.com/images/M/MV5BN2UyNzJhYjktNGYyZC00YmRkLThiYzUtNzFjMTBhMjdmNzQxXkEyXkFqcGc@._V1_.jpg,,
1699,tt13751982,Amar Prem,2020,Drama,Widow marriage is still considered a sin in progressive society of india even today. Film Amar prem raise questions on mentality of indian society and cover issues like widow marriage and honor killings.,Tanveer Hashmi,"Kundan Bhardwaj, Chandrima Banerjee, Kajal Chauhan, Ranjeet Jha",https://m.media-amazon.com/images/M/MV5BY2IzYWE4YWQtNjMzZC00ZjcxLWJmMDgtZDEzYTk5NmY5ZTU5XkEyXkFqcGc@._V1_.jpg,4.6,30
1700,tt2199330,Thadaiyara Thaakka,2012,"Action, Crime, Drama","A young man dreams of making a fortune in Chennai. He owns a travel agency and is all set to marry his lover. After he crosses paths with a loan shark, The Latter is Murdered, the young man runs for cover and plans to find the murderer.",Magizh Thirumeni,"Arun Vijay, Mamta Mohandas, Rakul Preet Singh, Vamsi Krishna",https://m.media-amazon.com/images/M/MV5BNjk0OGJmOGYtMTYzMi00NDkwLTgyODQtZWM2MjkxOWRmZGFiXkEyXkFqcGc@._V1_.jpg,7.3,791
1701,tt1169841,Return of Hanuman,2007,"Animation, Action, Adventure","A young boy, Minku, ridiculed by his friends, begs the gods to send him down to Earth, and his wish is granted.",Anurag Kashyap,"Kathleen Barr, Lillian Carlson, Raj Singh Jhinjar, Irfan Khan",https://m.media-amazon.com/images/M/MV5BN2QwMWVlZjAtN2UwOS00NTQ5LTllMjktZjUwZTE5ZTg4OTY4XkEyXkFqcGc@._V1_.jpg,7.5,1878
1702,tt1239276,Rang Rasiya,2008,"Biography, Drama, Romance",A look into the life of 19th century Indian painter Raja Ravi Varma.,Ketan Mehta,"Randeep Hooda, Nandana Sen, Paresh Rawal, Ashish Vidyarthi",https://m.media-amazon.com/images/M/MV5BN2FhN2JlMTktZjBlZC00MGY0LWFhN2QtMTZhYTkzYWEzOTA2XkEyXkFqcGc@._V1_.jpg,7,2078
1703,tt0476805,Malamaal Weekly,2006,"Comedy, Drama, Romance","Lilaram sells lottery tickets and one customer has hit the jackpot but dies of shock upon finding out that he has won. Now, Lilaram wants all the money, and so does everyone around him.",Priyadarshan,"Paresh Rawal, Om Puri, Riteish Deshmukh, Reema Sen",https://m.media-amazon.com/images/M/MV5BYzAxNzBmYjAtMThjNC00YjJmLTk5YzYtMDRiZThlYzYyMTlmXkEyXkFqcGc@._V1_.jpg,7,8273
1704,tt19284176,Ticket ek Sangharsh,2023,"Drama, Thriller","In Rudranagar, the ticket is not just integral but also has multiple and divergent connotations. Although meanings would not be consensually agreed upon, but the desire to get one ticket at all costs unifies them all.",Mahi Dubey,"Mahi Dubey, Nirmal Soni, Sanjay Dubey, Neha Sharma",https://m.media-amazon.com/images/M/MV5BODRhMWU2MzItN2NlMC00ZmYzLTg4MWUtOWM4ZjJjODZmYjUxXkEyXkFqcGc@._V1_.jpg,6.9,33
1705,tt27216785,Angithee 2,2023,Drama,"Kavya, a married woman, lives a dull life with her husband Rajeev in a small town of Jammu. Sick of the monotonous routine, she seeks happiness and excitement. This is when a young boy enters her life and makes her feel liberated.",Shoib Nikash Shah,"Rishi Bhutani, Fezan Khan, Shafaq Naaz",https://m.media-amazon.com/images/M/MV5BNjAxZGU5OTgtNjlkNS00ODM3LWFhNjctZjE1NTQxYzY5ZDc0XkEyXkFqcGc@._V1_.jpg,5.8,155
1706,tt28396066,Jaane Do,2023,Romance,A blind couple embark on a road trip only to break up from a relationship that they never entered.,Jugal Raja,"Pragati Anand, Abhishek Panwar",https://m.media-amazon.com/images/M/MV5BY2U0MWJjMjctZTU3MC00NGZjLTkwZTItNzBiNTAzMDcyNjdlXkEyXkFqcGc@._V1_.jpg,7.8,32
1707,tt7179784,Irumbu Thirai,2018,"Action, Crime, Thriller",A soldier takes on a gang of cyber criminals when money goes missing from his account.,P.S. Mithran,"Vishal, Samantha Ruth Prabhu, Arjun Sarja, Delhi Ganesh",https://m.media-amazon.com/images/M/MV5BNTYxNGY2ZWUtNmVkOC00NjcyLTk1ZWEtMWE3OWYxNjBmODE1XkEyXkFqcGc@._V1_.jpg,7.6,5822
1708,tt1887763,Haunted - 3D,2011,"Action, Fantasy, Horror",A realtor finds himself accompanied by two ghostly entities inside a mansion. He learns of a violent event that took place years ago and is sent back in time to prevent it from happening.,Vikram Bhatt,"Mimoh Chakraborty, Tia Bajpai, Achint Kaur, Mohan Kapur",https://m.media-amazon.com/images/M/MV5BNDUyYzk0MWQtYzY5ZS00YmNiLThmODYtNjg1MGJkNjIzMTNlXkEyXkFqcGc@._V1_.jpg,6.3,2827
1709,tt1191138,Thoda Pyaar Thoda Magic,2008,"Comedy, Drama, Family","An angel, a man and 4 orphans come together to bring you a story filled with fun, excitement, tears, love and magic.",Kunal Kohli,"Saif Ali Khan, Rani Mukerji, Rishi Kapoor, Akshat Chopra",https://m.media-amazon.com/images/M/MV5BZGUyM2U2NmItMmU4ZC00M2EyLThiZjktMDA5ODIzZjNiNzBkXkEyXkFqcGc@._V1_.jpg,5,3061
1710,tt0331639,Shakthi: The Power,2002,"Action, Drama, Thriller",A couple visits the husband's family in India and finds itself in the middle of a fratricidal battle.,Krishna Vamsi,"Karisma Kapoor, Nana Patekar, Sanjay Kapoor, Jai Gidwani",https://m.media-amazon.com/images/M/MV5BNTdjYTg3ZmEtYWRhMS00MzI2LWE2NDktN2Y4YTAyYWQxYjIxXkEyXkFqcGc@._V1_.jpg,6.1,5449
1711,tt0072777,Chhoti Si Baat,1976,"Comedy, Romance",A timid suitor seeks the help of a ruthless colonel to win the woman of his dreams when a bold young man begins to pursue her in this romantic comedy.,Basu Chatterjee,"Ashok Kumar, Vidya Sinha, Amol Palekar, Govardhan Asrani",https://m.media-amazon.com/images/M/MV5BNGQyNGFmZmYtZjhiNi00YmZkLWJmYTMtODkzN2I4YmNiOTdiXkEyXkFqcGc@._V1_.jpg,8.3,4592
1712,tt3142688,Finding Fanny,2014,"Adventure, Comedy, Drama",A man embarks on a road trip to find his lost love.,Homi Adajania,"Deepika Padukone, Arjun Kapoor, Naseeruddin Shah, Dimple Kapadia",https://m.media-amazon.com/images/M/MV5BMjE1Nzk2Mjk2OF5BMl5BanBnXkFtZTgwMTE5NTYxMjE@._V1_.jpg,5.7,6821
1713,tt0107777,Parampara,1993,"Action, Drama, Romance","The grandchildren of two sworn enemies want to put the bitterness between the families behind them, but will the bloodthirsty traditions compel them to do otherwise?",Yash Chopra,"Sunil Dutt, Vinod Khanna, Aamir Khan, Ashwini Bhave",https://m.media-amazon.com/images/M/MV5BOTUzNzljN2ItMzQxOC00NGY2LThhMTAtYzlmMmQ3NmNmY2E2XkEyXkFqcGc@._V1_.jpg,5,1240
1714,tt2354407,Teri Meri Kahaani,2012,"Comedy, Drama, Romance","The true love between a couple in 1910, 1960 and 2012. Their love is so strong that even destiny wants to bring them together.",Kunal Kohli,"Shahid Kapoor, Priyanka Chopra Jonas, Prachi Desai, Neha Sharma",https://m.media-amazon.com/images/M/MV5BMjAwNzY3NTc2NF5BMl5BanBnXkFtZTcwNTUwMTE3Nw@@._V1_.jpg,4.9,4337
1715,tt3531852,Bhoothnath Returns,2014,"Comedy, Drama, Fantasy","A ghost returns back from his world to prove something. But on earth, he has something more to do for his country.",Nitesh Tiwari,"Amitabh Bachchan, Boman Irani, Parth Bhalerao, Sanjay Mishra",https://m.media-amazon.com/images/M/MV5BMzk1MTMyMjAxMV5BMl5BanBnXkFtZTgwMDA1Mzc0MTE@._V1_.jpg,6.5,6372
1716,tt7881524,Arjun Patiala,2019,"Action, Comedy","This spoof comedy narrates the story of a cop Arjun Patiala (Diljit Dosanjh) and his sidekick Onidda Singh (Varun Sharma). Together, will they be able to accomplish their mission of a crime-free town with their goofy style of policing?",Rohit Jugraj,"Diljit Dosanjh, Kriti Sanon, Varun Sharma, Abhimanue Kamboj",https://m.media-amazon.com/images/M/MV5BOWJhYWIxOGMtOTJkZS00YjdjLThiMjAtNTI4ZmRhYjM3NGJjXkEyXkFqcGc@._V1_.jpg,4.4,1674
1717,tt22769958,Udd Jaa Nanhe Dil,,Family,"The principal of a high profile school comes across a bright kid Raghu who is the son of a dhobi, and he gives him an opportunity to learn in his school along with the kids coming from rich...                See full summary »",Swaroop Raj Medara,"Gaurav Kamble, Suniel Shetty, Surendra Pal, Rajgopal Iyer",https://m.media-amazon.com/images/M/MV5BNzYwZWYzODEtZDY0Mi00ZGJlLTg4YzEtODljMmU5MjhmMTJkXkEyXkFqcGc@._V1_.jpg,,
1718,tt10852008,Balakot: the true story,2020,Action,Film on Balakot air strikes 2019.,Omung Kumar,Vivek Oberoi,Not Available,7.3,23
1719,tt0107986,Roop Ki Rani Choron Ka Raja,1993,"Action, Drama, Musical","Custom Officer Verma red-handily catches Jagmohan Lal, alias Jugran, smuggling priceless diamonds through India's airport. Jugran kills Verma before Verma can arrest Jugran; Jugran goes on ...                See full summary »",Satish Kaushik,"Anil Kapoor, Sridevi, Anupam Kher, Paresh Rawal",https://m.media-amazon.com/images/M/MV5BMTQ5ODQ2NDM1N15BMl5BanBnXkFtZTgwNTE2MzUzMzE@._V1_.jpg,4.8,1071
1720,tt0061073,Teesri Manzil,1966,"Comedy, Musical, Mystery","A woman blames a nightclub drummer for the suspicious death of her sister, and seeks revenge. However, the pair work together to solve the mystery and become romantically involved, after he introduces himself under another name.",Vijay Anand,"Shammi Kapoor, Asha Parekh, Raj Mehra, Prem Chopra",https://m.media-amazon.com/images/M/MV5BYmIxMTM3MTItMjQ2Yy00ZjM4LThmNDMtN2I3NTMzNzMzYjliXkEyXkFqcGc@._V1_.jpg,7.5,1359
1721,tt0244776,Satyakam,1969,Drama,The tale begins in the final days of the British Raj in India. A cohort of engineering students graduate a few months before Independence. Satyapriya and Naren are among the graduate ...                See full summary »,Hrishikesh Mukherjee,"Ashok Kumar, Dharmendra, Sharmila Tagore, Rabi Ghosh",https://m.media-amazon.com/images/M/MV5BMGQ1MGQyNGYtOTg2MC00NzY5LWFhYTYtNGEwYzg3ZTM1ZjhmXkEyXkFqcGc@._V1_.jpg,8.3,863
1722,tt0363413,Agni Pankh,2004,"Action, Drama, Romance","Based on the true story of Air Force personnel in Srinagar, Kashmir.",Sanjeev Puri,"Jimmy Shergill, Sameer Dharmadhikari, Rahul Dev, Shamita Shetty",https://m.media-amazon.com/images/M/MV5BYTRmYTBlZTEtMjY3My00ZWMyLTg0NWUtYzFkMWJlMWY5NjE1XkEyXkFqcGc@._V1_.jpg,4.8,135
1723,tt6747420,Rajma Chawal,2018,"Comedy, Drama, Family",An internet-rookie father attempts to use social media to enhance his faltering relationship with his millennial son.,Leena Yadav,"Amyra Dastur, Mukesh Chhabra, Rishi Kapoor, Sheeba Chaddha",https://m.media-amazon.com/images/M/MV5BZGUyNjQxMTItZDk1NC00NGFjLWFjZDYtM2RmYTYwYjViNThkXkEyXkFqcGc@._V1_.jpg,5.7,1979
1724,tt0135161,Bhai,1997,"Action, Drama",A simpleton turns into a gangster after his younger brother is killed and sets out for revenge on the perpetrators who destroyed his life.,Deepak S. Shivdasani,"Suniel Shetty, Pooja Batra, Sonali Bendre, Shakti Kapoor",https://m.media-amazon.com/images/M/MV5BOWUwZDg2NGYtMWVlOC00MjQ2LWEzMWQtMzA5YjUwOWVhYzFhXkEyXkFqcGc@._V1_.jpg,5.3,527
